Judul,Gambar,Bahan,Langkah
Kentang Telur Bayam (Eat Clean Series),https://img-global.cpcdn.com/recipes/d24d55eb3fba924f/240x340cq50/kentang-telur-bayam-eat-clean-series-foto-resep-utama.webp,"1 ikat bayam; 4 buah kentang ukuran sedang; 3 butir telur; 2 buah tomat; 1 siung bawang putih; secukupnya daun kemangi; secukupnya daun oregano kering; 3 sdm minyak zaitun; 250 ml Air untuk merebus kentang; secukupnya garam, lada, kaldu jamur","1 Cuci bersih kentang, potong dadu, semakin kecil kentang dipotong semakin cepat matang nya, kemudian rebus kurang lebih 12 menit, untuk memastikan kematangan kentang dapat ditusuk dengan garpu (tips : masak kentang dengan kulitnya untuk menjaga nutrisi kentang) [Gambar: https://img-global.cpcdn.com/steps/07fffe21f216e571/160x128cq70/kentang-telur-bayam-eat-clean-series-langkah-memasak-1-foto.jpg] | 2 Sambil menunggu kentang matang siap kan bahan-bahan lain nya, petik daun bayam dan daun kemangi cuci bersih, cincang halus bawang putih [Gambar: https://img-global.cpcdn.com/steps/1881bf16acdcb3ec/160x128cq70/kentang-telur-bayam-eat-clean-series-langkah-memasak-2-foto.jpg] | 3 Setelah kentang matang, tiriskan | 4 Tumis bawang putih yg telah dicincang halus dengan minyak zaitun hingga wangi (tips : tidak perlu menunggu minyak zaitun panas, karena akan merusak kandungan minyak tersebut) [Gambar: https://img-global.cpcdn.com/steps/f18ec0771fbff062/160x128cq70/kentang-telur-bayam-eat-clean-series-langkah-memasak-4-foto.jpg] | 5 Setelah agak kecokelatan dan tercium wangi bawang, masukkan daun kemangi, tumis hingga layu dan mengeluarkan aroma wangi [Gambar: https://img-global.cpcdn.com/steps/7b2b3ae241e0331a/160x128cq70/kentang-telur-bayam-eat-clean-series-langkah-memasak-5-foto.jpg] | 6 Masuk kan kentang yang telah direbus, beri garam, lada, kaldu jamur dan oregano sesuai selera [Gambar: https://img-global.cpcdn.com/steps/c58777e4030762ad/160x128cq70/kentang-telur-bayam-eat-clean-series-langkah-memasak-6-foto.jpg] | 7 Setelah tercampur rata, masukkan daun bayam, tumis hingga layu dan merata [Gambar: https://img-global.cpcdn.com/steps/b9ca41a4d470996e/160x128cq70/kentang-telur-bayam-eat-clean-series-langkah-memasak-7-foto.jpg] | 8 Setelah bayam layu, masukkan tomat yang telah dipotong sesuai selera [Gambar: https://img-global.cpcdn.com/steps/f8b47a76c5889233/160x128cq70/kentang-telur-bayam-eat-clean-series-langkah-memasak-8-foto.jpg] | 9 Aduk aduk sebentar hingga rata, kemudian buat lubang untuk meletakkan telur, pecahkan telur di lubang tersebut, kemudian tutup dengan tutup wajan agar telur matang [Gambar: https://img-global.cpcdn.com/steps/64a81e0466c7132c/160x128cq70/kentang-telur-bayam-eat-clean-series-langkah-memasak-9-foto.jpg] | 10 Jika suka telur setengah matang, maka bisa untuk tetap menjaga kuning telur tetap bulat, karena saya lebih suka kuning telur matang, maka saya pecahkan kuning telurnya, bisa di tambahkan oregano lagi, atau keju jika suka. Sajikan setelah matang"
EAT CLEAN Day 8 (japchae shirataki),https://img-global.cpcdn.com/recipes/7ae215ba435f3ada/240x340cq50/eat-clean-day-8-japchae-shirataki-foto-resep-utama.webp,"1 bks bihun shirataki; 200 gr dada ayam tanpa tulang,potong dadu; 2 butir jamur kancing, iris tipis; 1 buah wortel, iris korek; 1 buah bawang bombay kecil, cincang; 1 sdm minyak untuk menumis; 2 sdm saus japchae; Kimchi","1 Cuci shirataki dengan air matang, tiriskan | 2 Tumis bawang bombay, ayam,jamur,wortel.hingga matang [Gambar: https://img-global.cpcdn.com/steps/31233aaadcca3786/160x128cq70/eat-clean-day-8-japchae-shirataki-langkah-memasak-2-foto.jpg, https://img-global.cpcdn.com/steps/0332fc154375794d/160x128cq70/eat-clean-day-8-japchae-shirataki-langkah-memasak-2-foto.jpg] | 3 Masukkan bihun yang sudah ditiriskan | 4 Jika sudah agak mengering,tambahkan saus japvhae,aduk hingga rata [Gambar: https://img-global.cpcdn.com/steps/a22666d4739bca71/160x128cq70/eat-clean-day-8-japchae-shirataki-langkah-memasak-4-foto.jpg, https://img-global.cpcdn.com/steps/014b2f7cb29ad595/160x128cq70/eat-clean-day-8-japchae-shirataki-langkah-memasak-4-foto.jpg] | 5 Hidangkan dengan tambahan kimchi"
Telur Kukus ‘B’Ayam (clean eat),https://img-global.cpcdn.com/recipes/1589de0819e97476/240x340cq50/telur-kukus-bayam-clean-eat-foto-resep-utama.webp,50 gr daging ayam cincang; 1 butir telur; 1 siung bawang putih (cincang); 1 sdm kecap asin; 3/4 batang sayur bayam; Secukupnya merica,"1 Marinasi ayam dengan 1 sdm kecap asin, bawang putih cincang dan merica sesuai selera. | 2 Kocok pelan saja telur hingga kuningnya tercampur (*jangan sampai berbuih, kalau mau lbh lembut hasilnya telur bs disaring dulu) | 3 Tambahkan air 50ml saja sambil diaduk pelan jangan sampai berbuih. | 4 Masukkan daging ayam yang sudah di marinasi dengan sendok kecil agar tidak menggumpal. Kemudian masukkan bayam yang sudah dicuci bersih. | 5 Kukus selama 15 menit. Angkat dan selesai, silahkan dinikmati. [Gambar: https://img-global.cpcdn.com/steps/f67f077772ae32ce/160x128cq70/telur-kukus-bayam-clean-eat-langkah-memasak-5-foto.jpg]"
Ayam ungkep (eat clean),https://img-global.cpcdn.com/recipes/1e43f5bf6075b0e3/240x340cq50/ayam-ungkep-eat-clean-foto-resep-utama.webp,1 bh dada ayam; Bumbu halus; 3 siung bawang putih; 5 siung bawang merah; 1 cm kunyit; 1 batang serai; 3 cm laos; 1 lembar daun salam; 3 lembar daun jeruk purut; Karbohidrat; Kentang kukus; Jagung manis kukus atau rebus,"1 Cuci bersih dada ayam buang senua kulit dan lemak. Potong kecil bisa bagi 4 kalo kecil. Potong kecil supaya bumbu nya bisa meresap ke ayam nya. | 2 Nyalakan kompor dengan api sedang. Tumis bumbu di atas teflon. Apabila terasa kesat saat meaduk, beri sedikit air. Aduk hingga bumbu matang. | 3 Masukkan dada ayam tumis sebentar bersama bumbu. Beri air secukupnya. Kecil kan api hingga yang paling kecil. Atau kalo punya slow cooker bs masak di slow cooker. | 4 Masak hingga matang."
Es Bir Bali No Sugar,https://img-global.cpcdn.com/recipes/5583f8fa309de521/240x340cq50/es-bir-bali-no-sugar-foto-resep-utama.webp,1 buah kelapa muda; 2 buah jeruk nipis; 5 tetes stevia; Secukupnya es batu,"1 Siapkan kelapa muda (air beserta dagingnya) [Gambar: https://img-global.cpcdn.com/steps/6686b8636a5611af/160x128cq70/es-bir-bali-no-sugar-langkah-memasak-1-foto.jpg] | 2 Beri perasan jeruk nipis dan stevia lalu aduk rata [Gambar: https://img-global.cpcdn.com/steps/a629071aa009493a/160x128cq70/es-bir-bali-no-sugar-langkah-memasak-2-foto.jpg] | 3 Taruh es batu di gelas, tuang es bir bali ke gelas saji, dan siap dinikmati [Gambar: https://img-global.cpcdn.com/steps/51892933d07f1d68/160x128cq70/es-bir-bali-no-sugar-langkah-memasak-3-foto.jpg, https://img-global.cpcdn.com/steps/2cafa04c30ff1790/160x128cq70/es-bir-bali-no-sugar-langkah-memasak-3-foto.jpg]"
Spicy Chicken Wings Versi 2,https://img-global.cpcdn.com/recipes/558877c463bf0ae1/240x340cq50/spicy-chicken-wings-versi-2-foto-resep-utama.webp,"1,5 kg sayap ayam (13 Pcs); Bumbu marinasi; 2 sdm bawang putih cincang; 1 sdt lada hitam bubuk; 1 sdm kaldu ayam; 1 sdm kaldu jamur; 1 sdm bubuk paprika; 1 sdm bubuk cabe; 2 sdm gula palm; 2 sdm garam; 2 sdm saus sambal; 2 sdm saus tomat; 2 sdm kecap manis; 2 sdm saus BBQ; 2 sdm kecap inggris; 2 sdm maizena","1 Potong-potong sayap ayam [Gambar: https://img-global.cpcdn.com/steps/b57030c959869b38/160x128cq70/spicy-chicken-wings-versi-2-langkah-memasak-1-foto.jpg] | 2 Tambahkan bumbu marinasi lalu diaduk sampai rata [Gambar: https://img-global.cpcdn.com/steps/8e69ce1a53d89ca4/160x128cq70/spicy-chicken-wings-versi-2-langkah-memasak-2-foto.jpg, https://img-global.cpcdn.com/steps/5bfddc86d542fd4f/160x128cq70/spicy-chicken-wings-versi-2-langkah-memasak-2-foto.jpg] | 3 Kukus ayam selama 30 menit [Gambar: https://img-global.cpcdn.com/steps/554adae5bd5d7a3d/160x128cq70/spicy-chicken-wings-versi-2-langkah-memasak-3-foto.jpg] | 4 Angkat untuk disimpan atau langsung digoreng [Gambar: https://img-global.cpcdn.com/steps/b2b48e91e7546b10/160x128cq70/spicy-chicken-wings-versi-2-langkah-memasak-4-foto.jpg]"
Diet/clean food ayam suwir diet,https://img-global.cpcdn.com/recipes/d6a6ded5a113a4de/240x340cq50/dietclean-food-ayam-suwir-diet-foto-resep-utama.webp,1/2 kg dada ayam; 1 serai memarkan; 2 ruas lengkuas (geprek); 2 ruas jahe (geprek); 2 lembar daun salam; 2 lembar daun jeruk; 10 cabe hijau iris serong; Bumbu halus; 4 siung bawang merah; 2 siung bawang putih; 2 biji cabe besar; 1 sdt merica; 1 sdt ketumbar; Penyedap rasa; Gula; Garam,"1 Kukus atau masak daging ayam, diamkan lalu sisir/ disuwir2 | 2 Ulek bumbu halus, tumis menggunakan teflon tambahkan sedikit air, masukan lengkuas, jahe, serai,cabe hijau, tunggu sampai air menyusut dan bumbu agak mengering, biarkan air sedikit menyusut, tambahkan gula, garam, penyedap | 3 Masukan ayam suwir, masak lagi sampai sedikit kering/bumbu meresap | 4 Koreksi rasa"
"Tumis Bakso Ayam [Eat Clean, Untuk Diet]",https://img-global.cpcdn.com/recipes/dbbe43bf5a0e71ff/240x340cq50/tumis-bakso-ayam-eat-clean-untuk-diet-foto-resep-utama.webp,2 genggam kacang panjang; 1 genggam tauge; 15 bakso ayam; 2 cabai merah; 3 cabai rawit; 4 bawang putih; 3 bawang merah; 1 sdm lada hitam bubuk; 2 sdm saori saus tiram; 1 sdm totole kaldu jamur; 1 sdm minyak; 200 ml air,"1 Panaskan minyak diatas teflon, lalu tumis cabai, bawang putih, bawang merah sampai harum | 2 Tambahkan 200 ml air masukkan kan kacang panjang & bakso ayam. Lalu tambahkan lada hitam bubuk, totole kaldu jamur, saori saus tiram | 3 Biarkan air sampai sedikit susut atau kacang panjang layu, koreksi rasa, tambahkan tauge. Masak hingga 3 menit. Sajikan."
Tumis Ayam Pokcoy (Menu Eat Clean 🥗),https://img-global.cpcdn.com/recipes/6dd0a46f65cdf5b9/240x340cq50/tumis-ayam-pokcoy-menu-eat-clean-foto-resep-utama.webp,200 gram fillet dada ayam; 1 buah tahu ukuran sedang; 5 buah pokcoy; 1 siung bawang putih; 1/4 siung bawang bombay; 1 sdm corn oil; 1 sdt merica bubuk; 1/2 sdt garam (bisa di skip),"1 Cuci bersih ayam, potong dadu. Tahu dicuci bersih dan dipotong dadu. Cuci bersih pokcoy, potong-potong sesuai selera, kalau mau utuh juga bisa disesuaikan. Cincang kasar bawang bombay. Geprek bawang putih. [Gambar: https://img-global.cpcdn.com/steps/44eb106ed996c8a4/160x128cq70/tumis-ayam-pokcoy-menu-eat-clean-langkah-memasak-1-foto.jpg, https://img-global.cpcdn.com/steps/348bdafa0749ae1a/160x128cq70/tumis-ayam-pokcoy-menu-eat-clean-langkah-memasak-1-foto.jpg, https://img-global.cpcdn.com/steps/ed128ef3ecb49e64/160x128cq70/tumis-ayam-pokcoy-menu-eat-clean-langkah-memasak-1-foto.jpg] | 2 Panaskan corn oil di atas api kecil. Masukkan bawang bombay dan bawang putih. Tumis hingga harum. Masukkan ayam, bolak balik, masak hingga daging berubah warna jadi putih. [Gambar: https://img-global.cpcdn.com/steps/7008efefa371434e/160x128cq70/tumis-ayam-pokcoy-menu-eat-clean-langkah-memasak-2-foto.jpg, https://img-global.cpcdn.com/steps/7e803024c3b50f84/160x128cq70/tumis-ayam-pokcoy-menu-eat-clean-langkah-memasak-2-foto.jpg] | 3 Tambahkan tahu dan merica bubuk, masak sampai berwarna kecoklatan. Terakhir masukkan pokcoy dan garam, biarkan layu. Angkat dan sajikan. [Gambar: https://img-global.cpcdn.com/steps/ee730f8c675d618d/160x128cq70/tumis-ayam-pokcoy-menu-eat-clean-langkah-memasak-3-foto.jpg, https://img-global.cpcdn.com/steps/60c54627c117ddb0/160x128cq70/tumis-ayam-pokcoy-menu-eat-clean-langkah-memasak-3-foto.jpg, https://img-global.cpcdn.com/steps/0a300252c28afdda/160x128cq70/tumis-ayam-pokcoy-menu-eat-clean-langkah-memasak-3-foto.jpg]"
Lontong homemade magiccom,https://img-global.cpcdn.com/recipes/4cffda444bb1365e/240x340cq50/lontong-homemade-magiccom-foto-resep-utama.webp,2 cup beras; 6 cup air; Sejumput garam; 1 sdm minyak goreng,"1 Cuci beras lalu masukkan air n garam,aduk rata [Gambar: https://img-global.cpcdn.com/steps/c513e722ae56cc09/160x128cq70/lontong-homemade-magiccom-langkah-memasak-1-foto.jpg, https://img-global.cpcdn.com/steps/10110d21895a154b/160x128cq70/lontong-homemade-magiccom-langkah-memasak-1-foto.jpg] | 2 Masak seperti biasa, sesekali dibuka n d aduk [Gambar: https://img-global.cpcdn.com/steps/3623fbe42eb2c580/160x128cq70/lontong-homemade-magiccom-langkah-memasak-2-foto.jpg, https://img-global.cpcdn.com/steps/6922dac641ec09e8/160x128cq70/lontong-homemade-magiccom-langkah-memasak-2-foto.jpg] | 3 Setelah matang,tunggu 10 menit, baru buka, beri minyak goreng, aduk2 sampai kehalusan yg diinginkan [Gambar: https://img-global.cpcdn.com/steps/b9a7e9f63ded1d7c/160x128cq70/lontong-homemade-magiccom-langkah-memasak-3-foto.jpg, https://img-global.cpcdn.com/steps/fcbad4c67b68ad5d/160x128cq70/lontong-homemade-magiccom-langkah-memasak-3-foto.jpg] | 4 Masukkan ke loyang yg sdh dialasi daun pisang, sambil di tekan2 sampai padat, saya pakai loyang uk 20*20. Diamkan sampai dingin/set [Gambar: https://img-global.cpcdn.com/steps/14fad3325e524a38/160x128cq70/lontong-homemade-magiccom-langkah-memasak-4-foto.jpg] | 5 Potong2 sesuai selera [Gambar: https://img-global.cpcdn.com/steps/036c10678a460670/160x128cq70/lontong-homemade-magiccom-langkah-memasak-5-foto.jpg, https://img-global.cpcdn.com/steps/04fdb159b745121c/160x128cq70/lontong-homemade-magiccom-langkah-memasak-5-foto.jpg]"
(Eat Clean Menu) Pepes Tahu & Tempe Teriyaki,https://img-global.cpcdn.com/recipes/0dcd61a04569ac0d/240x340cq50/eat-clean-menu-pepes-tahu-tempe-teriyaki-foto-resep-utama.webp,2 Buah Tahu; 2 Bawang Putih; 2 Bawang Merah; 2 Cabe Merah; 2 Batang Seledri; 2 Lembar Daun Salam; Secukupnya Garam; Secukupnya Merica; Tempe Teriyaki; 1 Bawang Putih; 1 Sachet Saus Teriyaki; Secukupnya Tempe; 1/2 Sdm Olive oil,"1 Hancurkan 2buah Tahu dicampur dengan 2baput 2bamer 2 cabe merah yang sudah dihaluskan tambahkan garam dan merica secukupnya kemudian aduk dengan potongan seledri dan 1 lembar daun salam lalu kukus hingga matang [Gambar: https://img-global.cpcdn.com/steps/81f720e0dad41aef/160x128cq70/eat-clean-menu-pepes-tahu-tempe-teriyaki-langkah-memasak-1-foto.jpg] | 2 Tumis 1 bawang putih dengan 1/2sdm olive oil kemudian tambahkan saus teriyaki lalu masukan tempe yang sudah dipotong kecil2, masukan sedikit air, oseng hingga kering | 3 Sajikan Tahu Kukus dan Tempe Teriyaki dengan Lalapan Kol, Kacang Panjang dan Tomat [Gambar: https://img-global.cpcdn.com/steps/8c4f3b15d6695119/160x128cq70/eat-clean-menu-pepes-tahu-tempe-teriyaki-langkah-memasak-3-foto.jpg]"
Pepes Nila (Menu Eat Clean 🐟),https://img-global.cpcdn.com/recipes/29a0fa3115665a8b/240x340cq50/pepes-nila-menu-eat-clean-foto-resep-utama.webp,"300 gr ikan Nila (bisa diganti ikan mujair/ikan mas/ikan kerapu/yang lainnya ya); 3 lembar daun jeruk; 2 lembar daun salam; secukupnya daun pisang (saya pakai alumunium foil); Bumbu Halus; 3 siung bawang merah; 1 siung bawang putih; 2 cabe keriting; 1 cabe rawit; 1 sdt kunyit bubuk (bisa diganti kunyit segar); 1 sdt ketumbar bubuk (bisa diganti merica butiran); 1/2 sdt garam (opsional, bisa diskip yaa)","1 Bersihkan ikan, buang insang dan isi perutnya, cuci bersih, kerat-kerat. Balurkan bumbu halus ke badan ikan, bungkus dengan daun pisang, masukkan kulkas dan biarkan 30 menit hingga bumbu meresap. [Gambar: https://img-global.cpcdn.com/steps/3df90b7b6fcdd2a9/160x128cq70/pepes-nila-menu-eat-clean-langkah-memasak-1-foto.jpg, https://img-global.cpcdn.com/steps/b42f3a95103fb2d8/160x128cq70/pepes-nila-menu-eat-clean-langkah-memasak-1-foto.jpg, https://img-global.cpcdn.com/steps/2fc5d95e0f120acd/160x128cq70/pepes-nila-menu-eat-clean-langkah-memasak-1-foto.jpg] | 2 Kukus ikan nila kurleb 30 menit atau sampai ikan matang, selanjutnya panggang pepes kurleb 10 menit atau hingga pepes kering. [Gambar: https://img-global.cpcdn.com/steps/7b2568e74ce1a64c/160x128cq70/pepes-nila-menu-eat-clean-langkah-memasak-2-foto.jpg]"
Lunch Box Idea (Eat Clean Series),https://img-global.cpcdn.com/recipes/0eb93071c96685f3/240x340cq50/lunch-box-idea-eat-clean-series-foto-resep-utama.webp,"1/4 kg dada ayam; 1/2 buah jeruk nipis untuk merendam daging ayam; 1 siung bawang putih; 200 gr atau 1 buah brokoli ukuran sedang; 1/2 buah bawang bombay; secukupnya garam, lada, minyak zaitun","1 Potong daging dada ayam tipis tipis, rendam dalam perasan jeruk nipis yang di campur sedikit air, diam kan 10 - 15 menit, kemudian cuci dengan air mengalir. Kemudian lumuri ayam dengan garam, lada, minyak zaitun dan bawang putih yang telah dicincang. Diamkan sekitar 15-20 menit agar meresap ke daging. [Gambar: https://img-global.cpcdn.com/steps/e99e438b57021f33/160x128cq70/lunch-box-idea-eat-clean-series-langkah-memasak-1-foto.jpg] | 2 Sambil menunggu ayam meresap, potong-potong brokoli, cuci bersih, kemudian beri minyak zaitun, garam dan lada. Diamkan sebentar [Gambar: https://img-global.cpcdn.com/steps/fea8b4c68ebae085/160x128cq70/lunch-box-idea-eat-clean-series-langkah-memasak-2-foto.jpg] | 3 Potong-potong bawang bombay sesuai selera [Gambar: https://img-global.cpcdn.com/steps/38d396229d0f321b/160x128cq70/lunch-box-idea-eat-clean-series-langkah-memasak-3-foto.jpg] | 4 Panggang ayam pada wajan dengan api sedang, tunggu sampai ayam berwarna putih dan bawahnya berwarna kecokelatan baru dibalik., sebaiknya tidak terlalu banyak di bolak balik, sehingga daging ayam tidak akan keras. Tidak perlu menggunakan minyak lagi, karena ayam sudah di rendam dengan minyak. Setelah kedua sisi bewarna kecokelatan, tiriskan [Gambar: https://img-global.cpcdn.com/steps/68234cd727317852/160x128cq70/lunch-box-idea-eat-clean-series-langkah-memasak-4-foto.jpg] | 5 Masa brokoli dan bawang bombay, aduk aduk sebentar, jangan terlalu lama agar tekstur kedua nya tidak terlalu lembek. Tidak perlu menggunakan minyak juga karena brokoli telah di lumuri dengan minyak sebelumnya. [Gambar: https://img-global.cpcdn.com/steps/9b64ec26e45aa361/160x128cq70/lunch-box-idea-eat-clean-series-langkah-memasak-5-foto.jpg] | 6 Bekal makan siang sudah siap, tinggal di tata dalam lunch box dengan nasi merah. [Gambar: https://img-global.cpcdn.com/steps/530c05c5d9a99ad8/160x128cq70/lunch-box-idea-eat-clean-series-langkah-memasak-6-foto.jpg]"
Pempek Nasi Pistel (Gluten Free),https://img-global.cpcdn.com/recipes/14f0e2d1f16bae11/240x340cq50/pempek-nasi-pistel-gluten-free-foto-resep-utama.webp,200 gr nasi sisa; 50 ml air panas; 2 siung bawang putih; 1 sdt garam; 1 sdt kaldu bubuk; 1/2 sdt gula pasir; 1 buah telur; 200 gr tepung sagu; Secukupnya pepaya tumis untuk isian,"1 Haluskan nasi, bawang putih, dan air. [Gambar: https://img-global.cpcdn.com/steps/03b50d6fff297c8e/160x128cq70/pempek-nasi-pistel-gluten-free-langkah-memasak-1-foto.jpg] | 2 Campurkan nasi tadi dengan telur dan seasoning. Aduk rata. [Gambar: https://img-global.cpcdn.com/steps/40ea25b7fc631f2a/160x128cq70/pempek-nasi-pistel-gluten-free-langkah-memasak-2-foto.jpg, https://img-global.cpcdn.com/steps/6c07f3b556c19f40/160x128cq70/pempek-nasi-pistel-gluten-free-langkah-memasak-2-foto.jpg, https://img-global.cpcdn.com/steps/08ef80313061ade6/160x128cq70/pempek-nasi-pistel-gluten-free-langkah-memasak-2-foto.jpg] | 3 Tambahkan sagu lalu aduk hingga semua tercampur. [Gambar: https://img-global.cpcdn.com/steps/6a9b3f50fc31d69a/160x128cq70/pempek-nasi-pistel-gluten-free-langkah-memasak-3-foto.jpg] | 4 Ambil sedikit adonan kasih isian lalu bentuk seperti pempek pistel. [Gambar: https://img-global.cpcdn.com/steps/52e1a6edffd6281f/160x128cq70/pempek-nasi-pistel-gluten-free-langkah-memasak-4-foto.jpg, https://img-global.cpcdn.com/steps/e8f7716aaee9518e/160x128cq70/pempek-nasi-pistel-gluten-free-langkah-memasak-4-foto.jpg] | 5 Goreng dengan minyak panas hingga matang. [Gambar: https://img-global.cpcdn.com/steps/db42904299abacdb/160x128cq70/pempek-nasi-pistel-gluten-free-langkah-memasak-5-foto.jpg]"
Mie Ayam Jamur Sehat (clean eat),https://img-global.cpcdn.com/recipes/54b2f4657fa8f829/240x340cq50/mie-ayam-jamur-sehat-clean-eat-foto-resep-utama.webp,2 buah bawang merah; 1 jari kecil jahe; 2 siung bawang putih; 1 buah cabe merah; 2 buah jamur kancing (champignon); 1 fillet dada ayam (dipotong dadu); 1 sdm kecap manis (tropicana); 1 sdm kecap asin; 1/2 sdt merica (sesuai selera),"1 Tumis semua bahan bahan yang sudah sediakan sampai wangi. [Gambar: https://img-global.cpcdn.com/steps/8628bbd83b8e3bc0/160x128cq70/mie-ayam-jamur-sehat-clean-eat-langkah-memasak-1-foto.jpg] | 2 Masukkan potongan ayam dan jamur, tambahkan kecap manis,asin dan merica. [Gambar: https://img-global.cpcdn.com/steps/39b501322432821f/160x128cq70/mie-ayam-jamur-sehat-clean-eat-langkah-memasak-2-foto.jpg] | 3 Tumis Hingga wangi dan rasa sesuai selera. [Gambar: https://img-global.cpcdn.com/steps/09fd5a15cf15f371/160x128cq70/mie-ayam-jamur-sehat-clean-eat-langkah-memasak-3-foto.jpg] | 4 Rebus sebentar mie shirataki selama 3 menit. Sajikan bersama telur rebus (sesuai selera) atau bisa juga sayur2an. | 5 Untuk kuah, siapkan kaldu ayam. Rebus ayam hingga air keruh. Garam dan perasa sesuai selera (saya tidak pakai). Sajikan dan taburkan daun bawang dan sedikit bawang goreng. [Gambar: https://img-global.cpcdn.com/steps/e1ffdb62f7181c2b/160x128cq70/mie-ayam-jamur-sehat-clean-eat-langkah-memasak-5-foto.jpg]"
Pisang Kukus Wangi Pandan,https://img-global.cpcdn.com/recipes/9c90a3d66e2d504e/240x340cq50/pisang-kukus-wangi-pandan-foto-resep-utama.webp,5 buah pisang kepok; 1 lembar daun pandan; Secukupnya air untuk merebus,"1 Didihkan air + daun pandan [Gambar: https://img-global.cpcdn.com/steps/36719f703b3f3baa/160x128cq70/pisang-kukus-wangi-pandan-langkah-memasak-1-foto.jpg] | 2 Taruh pisang kepok di kukusan, lalu taruh kukusan di atas panci [Gambar: https://img-global.cpcdn.com/steps/cc3afac6d0b8d73f/160x128cq70/pisang-kukus-wangi-pandan-langkah-memasak-2-foto.jpg] | 3 Kukus pisang kurang lebih 15 menit [Gambar: https://img-global.cpcdn.com/steps/0d7eca1b901c0107/160x128cq70/pisang-kukus-wangi-pandan-langkah-memasak-3-foto.jpg] | 4 Pisang kukus wangi pandan siap dinikmati [Gambar: https://img-global.cpcdn.com/steps/a91948201c4a8a9e/160x128cq70/pisang-kukus-wangi-pandan-langkah-memasak-4-foto.jpg]"
Pasta Ubi Ungu,https://img-global.cpcdn.com/recipes/b2666de64f2e9e54/240x340cq50/pasta-ubi-ungu-foto-resep-utama.webp,350 g Ubi ungu; 150 ml santan sedang; 6 sdm Gula pasir; 1/4 sdt Garam; 1/4 sdt pasta taro; 1/2 sdt vanili bubuk; 1 sdm margarin,"1 Rebus santan, lalu masukkan ubi ungu yg sudah direbus dan dihaluskan [Gambar: https://img-global.cpcdn.com/steps/0a35687f102bdb49/160x128cq70/pasta-ubi-ungu-langkah-memasak-1-foto.jpg, https://img-global.cpcdn.com/steps/55227c742ccc06f6/160x128cq70/pasta-ubi-ungu-langkah-memasak-1-foto.jpg] | 2 Masukkan gula, garam dan pasta taro, [Gambar: https://img-global.cpcdn.com/steps/227604aeb9790d47/160x128cq70/pasta-ubi-ungu-langkah-memasak-2-foto.jpg, https://img-global.cpcdn.com/steps/a195f8dd544e91f3/160x128cq70/pasta-ubi-ungu-langkah-memasak-2-foto.jpg, https://img-global.cpcdn.com/steps/6ac934a1599ea243/160x128cq70/pasta-ubi-ungu-langkah-memasak-2-foto.jpg] | 3 Tambahkan vanili cair, lalu aduk sampai rata dan kalis [Gambar: https://img-global.cpcdn.com/steps/f5cda0b4d3b14b90/160x128cq70/pasta-ubi-ungu-langkah-memasak-3-foto.jpg, https://img-global.cpcdn.com/steps/6ac10248578c155f/160x128cq70/pasta-ubi-ungu-langkah-memasak-3-foto.jpg, https://img-global.cpcdn.com/steps/450e00fab9638fb3/160x128cq70/pasta-ubi-ungu-langkah-memasak-3-foto.jpg] | 4 Setelah adonan pasta mulai kering masukkan maragarin, aduk rata. [Gambar: https://img-global.cpcdn.com/steps/52a9429d729118cc/160x128cq70/pasta-ubi-ungu-langkah-memasak-4-foto.jpg, https://img-global.cpcdn.com/steps/f54b9e01cdbe107c/160x128cq70/pasta-ubi-ungu-langkah-memasak-4-foto.jpg] | 5 Lalu bulat2 kan, dan siap untuk berbagai isian, Enjoy [Gambar: https://img-global.cpcdn.com/steps/90be4c5fc531e72f/160x128cq70/pasta-ubi-ungu-langkah-memasak-5-foto.jpg]"
Clean Eating Aini'Cooking #12,https://img-global.cpcdn.com/recipes/e2721dd2fea47f58/240x340cq50/clean-eating-ainicooking-12-foto-resep-utama.webp,5 Tahu kotak airfryer 5 menit; 2 gula jawa; 2 cabai rawit (tingkat kepedasan bisa disesuaikan dengan selera); 1 bawang putih; 1 air secukupnya; secukupnya Garam; secukupnya Kubis potong tipis; secukupnya Kacang giling kasar; secukupnya Tauge; 1 buah timun iris tipis; Secukupnya Gorengan (opsional) klo clean eating gak usah ya; 1 buah tomat potong jadi 6 bagian,"1 Tahu yang baru di airfryr masih dalam keadaan panas potong menjadi dadu-dadu kecil. | 2 Tambahkan irisan kubis segar dan seledri (jika suka, bisa ditambahkan tauge) ke dalam piring yang sama dengan tahu, tambahkan timun dan tomat juga. | 3 Haluskan bumbu yang sudah disediakan seperti bawang putih, cabe rawit, gula merah, kacang giling dan garam sesuai dengan selera. | 4 Setelah bumbu telah dihaluskan dengan baik, tambahkan air asem Jawa ke dalamnya. Campur rata agar rasa semakin manyatu. | 5 Tuangkan bumbu yang telah dihaluskan ke atas piring dengan tahu dan sayuran. Untuk cita rasa yang lebih kaya, tambahkan kecap manis di atasnya. | 6 Sajikan hidangan Tahu Masak dengan segera. Namun, jangan lupa untuk mencampurnya terlebih dahulu sebelum menikmatinya. [Gambar: https://img-global.cpcdn.com/steps/df9c55e4aa3ce48a/160x128cq70/clean-eating-ainicooking-12-langkah-memasak-6-foto.jpg]"
Clean Eating Aini'Cooking #7,https://img-global.cpcdn.com/recipes/68ed5db313274c34/240x340cq50/clean-eating-ainicooking-7-foto-resep-utama.webp,4 kacang panjang potong-potong lalu rebus 5 menitan; 1 bongkol jagung serut lalu rebus 4 menitan; 1 buah wortel kecil potong-potong korek lalu rebus 3 menitan; 1 buah timun lalu potong sesuai selera; 1 buah tomat potong menjadi 4 bagian; 1 butir telor rebus; secukupnya Kewpie wijen sangrai,"1 Siapkan semua bahan yang dibutuhkan | 2 Cuci bersih bahan yang dibutuhkan | 3 Potong-potong bahan sesuai instruksi diatas | 4 Rebus secara bertahap setiap bahannya lalu tiriskan | 5 Kupas telur rebus | 6 Siapkan wadah lalu plating menjadi satu, tambahkan kewpie wijen sangrai lalu siap dinikmati."
