Judul,Gambar,Bahan,Langkah
Nasi Goreng Mentega Kecap,https://img-global.cpcdn.com/recipes/c4f6de663936c60d/240x340cq50/nasi-goreng-mentega-kecap-foto-resep-utama.webp,1 porsi nasi putih; 3 lembar jamur kuping yg sydah di rendam air panas sebelumnya (bisa diskip / diganti wortel); 2 helai beef ham (bisa diganti daging cincang; 1 butir telur ayam; 1 sdm blueband; Secukupnya totole; Sedikit garam; secukuonya kecap,"1 Siapkan bahan [Gambar: https://img-global.cpcdn.com/steps/ba95f8b87fa703a3/160x128cq70/nasi-goreng-mentega-kecap-langkah-memasak-1-foto.jpg] | 2 Haluskan bawang putih kemudian potong kecil jamur kuping dan ham [Gambar: https://img-global.cpcdn.com/steps/df413973e28aa8d9/160x128cq70/nasi-goreng-mentega-kecap-langkah-memasak-2-foto.jpg] | 3 Panaskan wajan, masukkan blueband, aduk2 sampai meleleh [Gambar: https://img-global.cpcdn.com/steps/a9d0c7ca2f737f17/160x128cq70/nasi-goreng-mentega-kecap-langkah-memasak-3-foto.jpg] | 4 Masukkan bawang putih halus, aduk2 kemudian masukkan telur lalu orak arik, masukkan jamur kupimg yg sudah di potong dan beef ham gongseng hingga merata [Gambar: https://img-global.cpcdn.com/steps/3924e2291577c0c2/160x128cq70/nasi-goreng-mentega-kecap-langkah-memasak-4-foto.jpg, https://img-global.cpcdn.com/steps/b377c91f42dfba8a/160x128cq70/nasi-goreng-mentega-kecap-langkah-memasak-4-foto.jpg, //global-web-assets.cpcdn.com/assets/icons/button_play-114de81e44ebf74d6d50d473af3e1c021cdcc19e1075ff8f418706698785d5bb.png, https://img-global.cpcdn.com/steps/a02301b3b12cc257/160x128cq70/nasi-goreng-mentega-kecap-langkah-memasak-4-foto.jpg] | 5 Masukkan nasi, aduk sampai merata dan tdk ada yg menggumpal [Gambar: https://img-global.cpcdn.com/steps/8baba8e4691055d0/160x128cq70/nasi-goreng-mentega-kecap-langkah-memasak-5-foto.jpg] | 6 Masukkan totole dan garam dan kecap lalu aduk2 hingga tercampur rata [Gambar: https://img-global.cpcdn.com/steps/2b0db621ba71fb02/160x128cq70/nasi-goreng-mentega-kecap-langkah-memasak-6-foto.jpg, https://img-global.cpcdn.com/steps/6a93b53ed531c868/160x128cq70/nasi-goreng-mentega-kecap-langkah-memasak-6-foto.jpg] | 7 Koreksi rasa, jika sudah enak matikan kompor [Gambar: https://img-global.cpcdn.com/steps/d048bf571f82adfd/160x128cq70/nasi-goreng-mentega-kecap-langkah-memasak-7-foto.jpg] | 8 Sajikan, ini anak sy lahap banget makannya, enak dan mudah buatnya moms. [Gambar: https://img-global.cpcdn.com/steps/8e1c8a5544add9b2/160x128cq70/nasi-goreng-mentega-kecap-langkah-memasak-8-foto.jpg]"
216# SOP wortel eating clean,https://img-global.cpcdn.com/recipes/ddc95ceb1c60446f/240x340cq50/216-sop-wortel-eating-clean-foto-resep-utama.webp,3 buah wortel ukuran kecil; 1/2 bonggol jagung; 3 buah tomat (me skip); 1 batang daun bawang; 10 butir merica; 1/4 sdt garam; 400 ml air,"1 Siapkan semua bahan,kupas wortel cuci bersih iris sisihkan,kupas jagung cuci bersih iris satukan dengan wortel,didihkan air dipanci kemudian masukan wortel dan jagung masak 5 menit saja tambahkan garam dan merica yang telah dihaluskan angkat dan taburi bawang daun iris hidangkan.salam hangat 😘"
(Eat Clean Menu) Tumis Ikan Brokoli,https://img-global.cpcdn.com/recipes/ac01ff24d79d3361/240x340cq50/eat-clean-menu-tumis-ikan-brokoli-foto-resep-utama.webp,200 Gram Ikan Laut (saya pake tongkol); 100 Gram Brokoli; 1/8 Paprika (saya pake cabe besar); 2 Buah Tomat; 2 Siung Bawang Putih; 1/2 Bawang Bombay; 50 ml Air; 1 Sdt Olive Oil; Secukupnya Garam; Secukupnya Merica,"1 Cuci bersih brokoli, rendam dengan air garam 10 menit untuk mensterilkan rasa. Rebus selama 5 menit, angkat dan tiriskan. | 2 Cincang halus bawang putih dan bawang bombay kemudian tumis sampe harum dengan olive oil | 3 Masukkan air, kemudian ikan dan potongan 2 buah tomat serta 1/8 paprika. Tunggu hingga mateng, dan masukan brokoli yg sudah direbus tadi. Koreksi rasa campur garam dan merica 👌🏻 sajikan dengan potongan seledri. [Gambar: https://img-global.cpcdn.com/steps/955c17ad4acd0dc4/160x128cq70/eat-clean-menu-tumis-ikan-brokoli-langkah-memasak-3-foto.jpg]"
Lontong Daun,https://img-global.cpcdn.com/recipes/7e73af59c2405c77/240x340cq50/lontong-daun-foto-resep-utama.webp,1 kg beras; Secukupnya garam; Secukupnya air untuk merebus lontong; Secukupnya daun untuk membungkus lontong,"1 Cuci beras dan tiriskan [Gambar: https://img-global.cpcdn.com/steps/b7585fb121109d97/160x128cq70/lontong-daun-langkah-memasak-1-foto.jpg] | 2 Siapkan daun dan buat bungkusan. untuk ukuran bisa disesuaikan dengan ukuran daunnya. [Gambar: https://img-global.cpcdn.com/steps/5630fb6d1bab2ec6/160x128cq70/lontong-daun-langkah-memasak-2-foto.jpg, https://img-global.cpcdn.com/steps/32485df1f1bd9d38/160x128cq70/lontong-daun-langkah-memasak-2-foto.jpg, https://img-global.cpcdn.com/steps/f988c1221a1b94a0/160x128cq70/lontong-daun-langkah-memasak-2-foto.jpg] | 3 Setelah daun digulung tekuk sisi kanan dan kiri lalu semat memakai lidi. [Gambar: https://img-global.cpcdn.com/steps/be9ebe52c8525c9c/160x128cq70/lontong-daun-langkah-memasak-3-foto.jpg, https://img-global.cpcdn.com/steps/ad835ae396f4e867/160x128cq70/lontong-daun-langkah-memasak-3-foto.jpg, https://img-global.cpcdn.com/steps/c32b25be80d8d9d7/160x128cq70/lontong-daun-langkah-memasak-3-foto.jpg] | 4 Isi gulungan tadi dengan beras yg sudah dicuci. Untuk ukuran banyaknya beras sebanyak 3/4 dari gulungan daun. Lalu bungkus untuk sisi yang berbeda seperti langkah ke 3. [Gambar: https://img-global.cpcdn.com/steps/0d9468748f191e86/160x128cq70/lontong-daun-langkah-memasak-4-foto.jpg, https://img-global.cpcdn.com/steps/3d0f647a7b71d507/160x128cq70/lontong-daun-langkah-memasak-4-foto.jpg, https://img-global.cpcdn.com/steps/84d3285f31ff455d/160x128cq70/lontong-daun-langkah-memasak-4-foto.jpg] | 5 Tata bungkusan di panci besar lalu beri air sampai bungkusan tertutup air. [Gambar: https://img-global.cpcdn.com/steps/d2bf4ac8b434baee/160x128cq70/lontong-daun-langkah-memasak-5-foto.jpg, https://img-global.cpcdn.com/steps/abe726871dac0ef5/160x128cq70/lontong-daun-langkah-memasak-5-foto.jpg] | 6 Rebus 3 jam kalo memakai tungku kayu, rebus sampai 5 jam untuk pemakaian kompor. [Gambar: https://img-global.cpcdn.com/steps/ec1c00c53e9afd4f/160x128cq70/lontong-daun-langkah-memasak-6-foto.jpg] | 7 Saat direbus sering dicek airnya, jika dirasa kurang ditambahkan air lagi. Rebus sampai tanak, setelah matang angkat dan tiriskan lontong. Potong lontong setelah dingin. [Gambar: https://img-global.cpcdn.com/steps/1f6d69e6072f1ff9/160x128cq70/lontong-daun-langkah-memasak-7-foto.jpg]"
Diet/clean food Lodeh Ayam dan tempe,https://img-global.cpcdn.com/recipes/abeccdfae21284f5/240x340cq50/dietclean-food-lodeh-ayam-dan-tempe-foto-resep-utama.webp,1 dada ayam; 1 kotak tempe /200 gram; Bumbu halus; 5 siung bawang merah; 3 siung bawang putih; 1 ruas kunyit; 1 cabe besar; Bumbu cemplung; 10 cabe kecil (bisa skip untuk yg tdk suka pedas) iris tipis; 2 lembar daun jeruk; 2 lembar daun salam; 1 ruas lengkuas; Sejumput penyedap rasa; Sejumput gula,"1 Iris tipis bumbu halus agar mudah menghaluskannya [Gambar: https://img-global.cpcdn.com/steps/ac2a379cb82a309f/160x128cq70/dietclean-food-lodeh-ayam-dan-tempe-langkah-memasak-1-foto.jpg] | 2 Tumis bumbu halus, menggunakan teflon, beri sedikit air, masukan bumbu cemplung. Tumis sampai agak kering (karena sy tdk pernah pakai minyak goreng sedikitpun) [Gambar: https://img-global.cpcdn.com/steps/679cbc505db5f30a/160x128cq70/dietclean-food-lodeh-ayam-dan-tempe-langkah-memasak-2-foto.jpg] | 3 Setelah bumbu harum, masukkan ayam dan tempe, tambahkan air secukupnya [Gambar: https://img-global.cpcdn.com/steps/85cd1d4c3aa731ac/160x128cq70/dietclean-food-lodeh-ayam-dan-tempe-langkah-memasak-3-foto.jpg] | 4 Setelah mendidih, meletup2 tambahkan penyedap dan gula | 5 Siap dihidangkan"
Ikan Dori Bumbu merah for diet clean food,https://img-global.cpcdn.com/recipes/88d51d1b53995c61/240x340cq50/ikan-dori-bumbu-merah-for-diet-clean-food-foto-resep-utama.webp,1 potong ikan dori (potong selebar 2 jari); 1/2 bawang Bombay (di iris); 3 buah bawang merah; 1 buah lombok merah; 2 lembar daun jeruk; 1 buah tomat; 1 lembar daun salam; 1 ruas serai; 1/2 sendok teh garam lososa; Gula secukupnya (gula tropicana); secukupnya Merica,"1 Karena ini clean food maka harus bebas minyak jadi menggunakan air secukupnya untuk menumis masukkan bawah merah, bawang Bombay, serta garam, merica dan gula | 2 Masukkan daun jeruk dan daun salam setelah itu masukkan ikan Dori yg SDH di iris | 3 Masukkan serai yg SDH d geprek | 4 Ungep dengan tutup sebentar sampai air mulai asat dan siap di hidangkan"
Eating Clean = oatmeals!,https://img-global.cpcdn.com/recipes/0a17eec5b3be6e3b/240x340cq50/eating-clean-oatmeals-foto-resep-utama.webp,35 gr oatmeal seduh (aku pake quacker oats warna merah); 1 sdt selai coklat hazelnut (bisa diganti selai kacang); 45 ml susu kedelai hangat (bisa diganti air hangat/susu hangat); sesuka selera Buah-buahan; 1 buah kurma,"1 Pertama tama marilah kita membaca bismillah bersama. Oiya disini aku pakai takaran sesuai anjurannya ya, bisa dilihat di kemasannya. Dan menurutku 35gr oatmeal sudah mengenyangkan 🥰 oiya bun, kalo susu kedelainya diganti susu hangat/air hangat nggapapa, cuma kl buat sarapan prefer non hewani jadinya kl ngga susu kedelai ya air hangat. [Gambar: https://img-global.cpcdn.com/steps/d8d671045d36025c/160x128cq70/eating-clean-oatmeals-langkah-memasak-1-foto.jpg] | 2 Untuk tambahan kalori, aku tambahin selai, cukup 1 sdt aja (kurang lebih 5-14 gr) karena untuk satu porsi anjurannya memang segitu hehe (sesuai takaran di kemasan). Kalau sudah, aduk rata. [Gambar: https://img-global.cpcdn.com/steps/3c8d422cfc1d9058/160x128cq70/eating-clean-oatmeals-langkah-memasak-2-foto.jpg, https://img-global.cpcdn.com/steps/3ac13f2ef496e43e/160x128cq70/eating-clean-oatmeals-langkah-memasak-2-foto.jpg] | 3 Untuk jenis buah bebas ya bun. Kalau mau ditambah kalori bisa pakai 1/2 pisang ambon atau 1 buah kurma, tapi terserah sih krn banyak makan buah waktu sarapan itu baik. Selesai🥳 selamat mencoba.(oiya biasanya sebelum sarapan ritual minum segelas air putih dulu, biar autokenyang hehe) [Gambar: https://img-global.cpcdn.com/steps/aa5516af17d779ea/160x128cq70/eating-clean-oatmeals-langkah-memasak-3-foto.jpg]"
Bakso Bakar Pedas Manis,https://img-global.cpcdn.com/recipes/6385d73694af6631/240x340cq50/bakso-bakar-pedas-manis-foto-resep-utama.webp,"21 bh Bakso nasi ayam siap pakai


Bakso Nasi Ayam; Bumbu Oles :; 2 sdm saus tiram; 2 sdm kecap manis; 1 sdm saus sambal (sy skip); 1 sdm saus tomat; 1/4 sdt lada bubuk; 1/4 sdt ketumbar bubuk; 1/4 sdt bawang putih bubuk","1 Tusuk bakso pada tusuk sate masing² 3 bh bakso. [Gambar: https://img-global.cpcdn.com/steps/d75005c1c21a9ad7/160x128cq70/bakso-bakar-pedas-manis-langkah-memasak-1-foto.jpg] | 2 Panaskan pan anti lengket, bakar bakso sambil diolesi bumbu. [Gambar: https://img-global.cpcdn.com/steps/ca84358dd561bbd8/160x128cq70/bakso-bakar-pedas-manis-langkah-memasak-2-foto.jpg, https://img-global.cpcdn.com/steps/e909fce603c0cc65/160x128cq70/bakso-bakar-pedas-manis-langkah-memasak-2-foto.jpg] | 3 Bakar hingga bumbu meresap dan matang, angkat, sajikan. [Gambar: https://img-global.cpcdn.com/steps/d38cc77368aab21d/160x128cq70/bakso-bakar-pedas-manis-langkah-memasak-3-foto.jpg]"
Sup Udang Tahu (Eat Clean Series),https://img-global.cpcdn.com/recipes/8d76f0f3bdef04eb/240x340cq50/sup-udang-tahu-eat-clean-series-foto-resep-utama.webp,"250 gr Udang ukuran sedang; 5 buah tahu putih, potong potong; 200 gr brokoli; 1 buah tomat; 3 siung bawang putih; 4 siung bawang merah; 1 ruas jari jahe, geprek; 0,5 buah bawang bombay (opsional); secukupnya garam, merica, kaldu jamur; 1 buah jeruk lemon/nipis; 3 buah cabe rawit pedas; 500 ml air; minyak zaitun untuk menumis","1 Rendam udang menggunakan air jeruk nipis/lemon sekitar 15 menit kemudian cuci dan bilas | 2 Kupas kulit dan kepala udang(jangan dibuang, karena untuk membuat kaldu seafood), dan pisahkan dari dagingnya | 3 Cuci dan potong brokoli, tomat, cincang halus bawang putih, merah | 4 Buat kaldu seafood : tumis kulit udang dan kepala udang​ hingga berwarna kemerahan dan harum, kemudian masukkan air, masak hingga mendidih, setelah mendidih saring untuk mendapatkan kuah kaldu yang jernih | 5 Masak lagi kaldu di atas api sedang, masukkan bawang putih, bawang merah dan bawang bombay. Beri garam, merica dan kaldu bubuk | 6 Masukkan udang, tahu dan jahe yg telah digeprek. Koreksi rasa tambahkan bumbu jika dirasa kurang | 7 Terakhir masukan brokoli dan tomat. Tidak perlu lama lama agar sayur tidak overcooked. Matikan api, sajikan selagi hangat"
909. Abon Ayam,https://img-global.cpcdn.com/recipes/cc5f27b83597cd9c/240x340cq50/909-abon-ayam-foto-resep-utama.webp,"500 gr fillet ayam; 500 ml air; 150 ml air rebusan ayam; 65 ml santan instant; 2 lembar daun salam; 4 lembar daun jeruk; Bumbu yang dihaluskan; 5 butir bawang merah; 3 siung bawang putih; 3 batang sereh ambil putihnya iris; 1 ruas jahe, kupas iris tipis; 3 ruas lengkuas muda, iris tipis; 1/2 sdt ketumbar bubuk; 1/2 sdt lada bubuk; 1/2 sdt kunyit bubuk; Bumbu tambahan; 1/2 sdt garam; 1/2 sdt gula pasir Rosebrand; 2 sdm.minyak untuk menumis","1 Siapkan bahan, rebus ayam dengan daun salam dan jeruk kurang lebih 15 menit hingga matang, suwir-suwir, aku dihaluskan dengan ulekan baru disuwir. [Gambar: https://img-global.cpcdn.com/steps/d03c01ddb0592903/160x128cq70/909-abon-ayam-langkah-memasak-1-foto.jpg, https://img-global.cpcdn.com/steps/f12036a3bf124096/160x128cq70/909-abon-ayam-langkah-memasak-1-foto.jpg, https://img-global.cpcdn.com/steps/52c6d60ebd4c6d66/160x128cq70/909-abon-ayam-langkah-memasak-1-foto.jpg] | 2 Blender bumbu yang yang dihaluskan, tumis dengan 2 sdm minyak hingga harum, masukkan santan, tambahkan air rebusan ayam. Masak hingga matang dengan api kecil, masukkan ayam. [Gambar: https://img-global.cpcdn.com/steps/859eb1345d758462/160x128cq70/909-abon-ayam-langkah-memasak-2-foto.jpg, https://img-global.cpcdn.com/steps/85c8a24a723bed97/160x128cq70/909-abon-ayam-langkah-memasak-2-foto.jpg, https://img-global.cpcdn.com/steps/53517d8a19309e5c/160x128cq70/909-abon-ayam-langkah-memasak-2-foto.jpg] | 3 Aduk sesekali, masak hingga ayam kering, beri garam dan gula pasir. Aduk rata. [Gambar: https://img-global.cpcdn.com/steps/2860669e326e840c/160x128cq70/909-abon-ayam-langkah-memasak-3-foto.jpg, https://img-global.cpcdn.com/steps/6ae0f5eb61d799fc/160x128cq70/909-abon-ayam-langkah-memasak-3-foto.jpg, https://img-global.cpcdn.com/steps/a33859ff43168457/160x128cq70/909-abon-ayam-langkah-memasak-3-foto.jpg] | 4 Jika sdh dingin simpan dalam wadah tertutup, siap dinikmati. [Gambar: https://img-global.cpcdn.com/steps/934d7964cc1192e8/160x128cq70/909-abon-ayam-langkah-memasak-4-foto.jpg]"
Sop Makaroni Buncis Jadul/Green Beans Macaroni Soup,https://img-global.cpcdn.com/recipes/e2180edc3a682cbd/240x340cq50/sop-makaroni-buncis-jadulgreen-beans-macaroni-soup-foto-resep-utama.webp,200 gr boneless chicken; 200 gr macaroni; 1/2 head of cauliflower; 2 carrots; 150 gr green beans (clean the sides strings and cut 2 cm); 150 gr meatballs/sausages; 1 onion (fried it) for topping; 6 cloves of garlic; 1.5 tsp black/white pepper; 3 stalks of spring onions; 3 stalks of celery; 1 tomato; to taste salt; 8-9 cups of water; 4 tbsp veg oil; 1 tsp sugar,"1 Preheat the saucepan, add veg oil, and saute the garlic black pepper paste. Once it is golden brown add cuts chicken, keep stirring it for 5 minutes. Panaskan panci, tambahkan minyak sayur, dan tumis bawang putih lada hitam yg sudah dihaluskan. Setelah berwarna cokelat keemasan tambahkan potongan ayam, terus aduk selama 5 menit. [Gambar: https://img-global.cpcdn.com/steps/df64794a5cd8a967/160x128cq70/sop-makaroni-buncis-jadulgreen-beans-macaroni-soup-langkah-memasak-1-foto.jpg, https://img-global.cpcdn.com/steps/03e72a4d14a56d5d/160x128cq70/sop-makaroni-buncis-jadulgreen-beans-macaroni-soup-langkah-memasak-1-foto.jpg, https://img-global.cpcdn.com/steps/b135d4f3462c7f11/160x128cq70/sop-makaroni-buncis-jadulgreen-beans-macaroni-soup-langkah-memasak-1-foto.jpg] | 2 Add the water, leave it till it boiled. Once it is boiled add the macaroni, leave it until the macaroni is cooked. Tambahkan air, biarkan hingga mendidih. Setelah mendidih masukkan makaroni, diamkan hingga makaroni matang. [Gambar: https://img-global.cpcdn.com/steps/548c4f09586f841c/160x128cq70/sop-makaroni-buncis-jadulgreen-beans-macaroni-soup-langkah-memasak-2-foto.jpg, https://img-global.cpcdn.com/steps/7ccc9aa347094362/160x128cq70/sop-makaroni-buncis-jadulgreen-beans-macaroni-soup-langkah-memasak-2-foto.jpg, https://img-global.cpcdn.com/steps/08dbf9c6ca08ea4a/160x128cq70/sop-makaroni-buncis-jadulgreen-beans-macaroni-soup-langkah-memasak-2-foto.jpg] | 3 When the macaroni is ready then add the diced carrots, cauliflower, and green beans. Leave it again till the soup boiled. Jika makaroni sudah matang, tambahkan potongan wortel, kembang kol, dan buncis. Biarkan lagi sampai sup mendidih. [Gambar: https://img-global.cpcdn.com/steps/4ca105e650a4fbb5/160x128cq70/sop-makaroni-buncis-jadulgreen-beans-macaroni-soup-langkah-memasak-3-foto.jpg, https://img-global.cpcdn.com/steps/7ba0e99650ef6934/160x128cq70/sop-makaroni-buncis-jadulgreen-beans-macaroni-soup-langkah-memasak-3-foto.jpg, https://img-global.cpcdn.com/steps/3cc3b9269743c07a/160x128cq70/sop-makaroni-buncis-jadulgreen-beans-macaroni-soup-langkah-memasak-3-foto.jpg] | 4 Once the soup boiled add the meatballs, continue to cook it for 5 minutes, lastly add the diced tomato, spring onion, and celery and cook it more for 2 minutes. Setelah sup mendidih tambahkan bakso, lanjutkan memasak selama 5 menit, terakhir tambahkan tomat potong dadu, daun bawang, dan seledri dan masak lagi selama 2 menit. [Gambar: https://img-global.cpcdn.com/steps/8016099c54e71a81/160x128cq70/sop-makaroni-buncis-jadulgreen-beans-macaroni-soup-langkah-memasak-4-foto.jpg] | 5 Green beans macaroni soup is ready to serve added with fry onion as a topping for the beloved family added with “sambal kecap” (spicy sweet soy sauce) to add the deliciousness. Sop buncis makaroni siap dihidangkan ditambah bawang goreng sebagai topping untuk keluarga tercinta ditambah sambal kecap untuk menambah kelezatannya. Bon Appetite! Selamat Makan! [Gambar: https://img-global.cpcdn.com/steps/9a4bfd6915396d9a/160x128cq70/sop-makaroni-buncis-jadulgreen-beans-macaroni-soup-langkah-memasak-5-foto.jpg, https://img-global.cpcdn.com/steps/b73f125c19ede8e8/160x128cq70/sop-makaroni-buncis-jadulgreen-beans-macaroni-soup-langkah-memasak-5-foto.jpg]"
Pengetan udah tahu tempre (eat clean),https://img-global.cpcdn.com/recipes/f84ed3ce89f0837e/240x340cq50/pengetan-udah-tahu-tempre-eat-clean-foto-resep-utama.webp,"1/2 kg udang; 1/4 papan tempe,kukus; 1 1/2 buah tahu,kukus; secukupnya air untuk kuah; bumbu; 3 siung bawang putih,iris tipis; 6 siung bawang merah,iris tipis; 1 lembar daun salam; 2 buah cabe merah,iris ±1cm; 10 buah belimbing wuluh; 1/4 sdt ketumbar; 1/4 sdt merica; 1 buah tomat,iris jadi 4; secukupnya gulgar","1 Tumis bawang putih,bawang merah dan salam sampai wangi dengan minyak zaitun,masukkan udang,masak hingga kemerahan dan keluar air kaldunya dengan api keciiil | 2 Tambahkan air,masukkan tahu,tempe dan semua bumbu lainnya,masak hingga matang | 3 Siap dihidangkan [Gambar: https://img-global.cpcdn.com/steps/9420a5098b260fb4/160x128cq70/pengetan-udah-tahu-tempre-eat-clean-langkah-memasak-3-foto.jpg]"
Sop Wortel Eating Clean,https://img-global.cpcdn.com/recipes/d36bec40f3b06792/240x340cq50/sop-wortel-eating-clean-foto-resep-utama.webp,1 bh wortel; 1 kuntum bunga kol; 1 bh tomat; Segenggam daun kelor; Seckpnya udang; Seckpnya merica butiran; Seckpnya garam krosok; 1 btg daun bawang; Sedikit daun seledri,"1 Cuci bersih sayuran, lalu potong2. Bersihkan jg udangnya [Gambar: https://img-global.cpcdn.com/steps/3f8dac0c97104c33/160x128cq70/sop-wortel-eating-clean-langkah-memasak-1-foto.jpg, https://img-global.cpcdn.com/steps/de3b3d8536086538/160x128cq70/sop-wortel-eating-clean-langkah-memasak-1-foto.jpg, https://img-global.cpcdn.com/steps/1ea9fa9560892125/160x128cq70/sop-wortel-eating-clean-langkah-memasak-1-foto.jpg] | 2 Didihkan air. Masukkan wortel dan bunga kol. Masak setengah matang [Gambar: https://img-global.cpcdn.com/steps/7ed9e2588351631c/160x128cq70/sop-wortel-eating-clean-langkah-memasak-2-foto.jpg] | 3 Masukkan udang, dan daun kelor. Aduk. [Gambar: https://img-global.cpcdn.com/steps/152c4ba71a3b3277/160x128cq70/sop-wortel-eating-clean-langkah-memasak-3-foto.jpg] | 4 Matikan api. Masukkan tomat. Juga garam dan merica yg telah di haluskan. Taburi daun bawang dan seledri saat di hidangkan. [Gambar: https://img-global.cpcdn.com/steps/6d2771e5ddfa2280/160x128cq70/sop-wortel-eating-clean-langkah-memasak-4-foto.jpg, https://img-global.cpcdn.com/steps/8d9cc72b360c9675/160x128cq70/sop-wortel-eating-clean-langkah-memasak-4-foto.jpg]"
Diet/clean food Dada ayam bakar pedas manis,https://img-global.cpcdn.com/recipes/19dec833dbb1fa19/240x340cq50/dietclean-food-dada-ayam-bakar-pedas-manis-foto-resep-utama.webp,"2 dada ayam potong dadu(sesuai selera); Bumbu halus; 3 siung bawang merah; 2 siung bawang putih; 1 biji cabe besar; 10 biji cabe kecil (boleh skip); Sedikit merica; Sedikit ketumbar; Penyedap, gula; 2 sdm kecap manis; 1 sdt saos tiram","1 Bersihkan dada ayam, iris2 biar bumbu meresap | 2 Haluskan bumbu, tambahkan kecap, menyedap, gula, garam | 3 Masukan ayam, | 4 Siapkan nampan mikrowave, panggang di suhu 250° selama 45 menit"
Onigiri Lemper,https://img-global.cpcdn.com/recipes/f251c6a93f51655c/240x340cq50/onigiri-lemper-foto-resep-utama.webp,250 gr beras ketan putih; 1 cup beras nasi; 200 ml santan instan; 1 gelas air; 1 sdt garam; 100 gr abon; 2 lembar daun pandan; 2 pack onigiri isi 10pcs,"1 Cuci bersih beras ketan lalu rendam minimal 1 jam. [Gambar: https://img-global.cpcdn.com/steps/0fc2eed8ac4cb0ff/160x128cq70/onigiri-lemper-langkah-memasak-1-foto.jpg] | 2 Cuci beras biasa lalu campurkan ke beras ketan dalam panci. [Gambar: https://img-global.cpcdn.com/steps/bdd1c7c6d3dd00bb/160x128cq70/onigiri-lemper-langkah-memasak-2-foto.jpg, https://img-global.cpcdn.com/steps/16cd59a8d12b8853/160x128cq70/onigiri-lemper-langkah-memasak-2-foto.jpg] | 3 Masak dengan api kecil sambil diaduk sampai airnya asat. [Gambar: https://img-global.cpcdn.com/steps/48af8a5d50edb45f/160x128cq70/onigiri-lemper-langkah-memasak-3-foto.jpg] | 4 Tambahkan air, santan, garam, dan pandan. Aduk rata. [Gambar: https://img-global.cpcdn.com/steps/9ddd44f3b35c4401/160x128cq70/onigiri-lemper-langkah-memasak-4-foto.jpg, https://img-global.cpcdn.com/steps/d74e606bfb518c43/160x128cq70/onigiri-lemper-langkah-memasak-4-foto.jpg] | 5 Ambil nasi ketan yang sudah matang, masukkan ke cetakan. Beri isian abon lalu tutup lagi dengan nasi ketan. [Gambar: https://img-global.cpcdn.com/steps/7906d592264eb250/160x128cq70/onigiri-lemper-langkah-memasak-5-foto.jpg, https://img-global.cpcdn.com/steps/44120501ef4b2a10/160x128cq70/onigiri-lemper-langkah-memasak-5-foto.jpg] | 6 Panaskan kukusan. Pindahkan beras setengah matang tadi ke kukusan. Kukus selama 20-30 menit atau sampai matang. [Gambar: https://img-global.cpcdn.com/steps/495572f33dd2d462/160x128cq70/onigiri-lemper-langkah-memasak-6-foto.jpg, https://img-global.cpcdn.com/steps/613d719ee7650388/160x128cq70/onigiri-lemper-langkah-memasak-6-foto.jpg] | 7 Pindah ke plastik, padatkan dan tekan sampai membentuk segitiga manual dengan tangan. [Gambar: https://img-global.cpcdn.com/steps/a17292dffe58dc43/160x128cq70/onigiri-lemper-langkah-memasak-7-foto.jpg, https://img-global.cpcdn.com/steps/52436d1050265b20/160x128cq70/onigiri-lemper-langkah-memasak-7-foto.jpg] | 8 Beri onigiri. Siap disajikan. ❤ [Gambar: https://img-global.cpcdn.com/steps/f9f2273a22db2b0e/160x128cq70/onigiri-lemper-langkah-memasak-8-foto.jpg, https://img-global.cpcdn.com/steps/7175e5c147cce9b9/160x128cq70/onigiri-lemper-langkah-memasak-8-foto.jpg, https://img-global.cpcdn.com/steps/af71bbce6574ceb9/160x128cq70/onigiri-lemper-langkah-memasak-8-foto.jpg]"
Chicken Breast with Spinach and Friends (clean eat),https://img-global.cpcdn.com/recipes/76a6cfcdbaceedc9/240x340cq50/chicken-breast-with-spinach-and-friends-clean-eat-foto-resep-utama.webp,1 ikat bayam; 1 batang wortel; 1/4 potong bawang bombay; 2 siung bawang putih; 3 potong fillet ayam; 1 sdt olive oil; 1 sdt bawang putih bubuk; 1/4 gelas air; 1 butir telur putih (optional kalau ingin tambahan protein baik),"1 Tumis bawang putih, bawang bombay dengan olive oil hingga wangi. [Gambar: https://img-global.cpcdn.com/steps/2873be3a5c3c1826/160x128cq70/chicken-breast-with-spinach-and-friends-clean-eat-langkah-memasak-1-foto.jpg] | 2 Masukkan putih telur dan ayam yang sudah dipotong (ayam sebaiknya sudah direbus terlebih dahulu) selama 5 menit. [Gambar: https://img-global.cpcdn.com/steps/f99116823669c262/160x128cq70/chicken-breast-with-spinach-and-friends-clean-eat-langkah-memasak-2-foto.jpg] | 3 Terakhir masukkan wortel dan bayam. Lalu masukkan bubuk bawang putih dan air. Jangan terlalu lama dengan api kecil tutup pan dan biarkan seperti kukus sebentar. Lalu buka dan biarkan kuah sedikit meresap. [Gambar: https://img-global.cpcdn.com/steps/3cf86556899a9a51/160x128cq70/chicken-breast-with-spinach-and-friends-clean-eat-langkah-memasak-3-foto.jpg] | 4 Tadahhh... silahkan mencoba :) [Gambar: https://img-global.cpcdn.com/steps/8d36d065f6427d5a/160x128cq70/chicken-breast-with-spinach-and-friends-clean-eat-langkah-memasak-4-foto.jpg]"
