Judul,Gambar,Bahan,Langkah
Pempek Tenggiri Tanpa Tepung clean eating,https://img-global.cpcdn.com/recipes/b6d703c490ec0447/240x340cq50/pempek-tenggiri-tanpa-tepung-clean-eating-foto-resep-utama.webp,250 gram ikan tenggiri giling; 2 bawang putih haluskan; 1/2 sdt Garam himsalt; 1 putih telur; Untuk bahan Cuko; 200 gram gula aren; 1 sdt Garam himsalt; 4 bawang putih; 10 biji cabe rawit hijau; 4 biji jeruk kunci; 300 ml Air mineral,"1 Campur bahan jadi satu sampai tercampur rata sebaiknya ikan yg baru keluar dari freezer...kalo pake daging tenggiri fresh blender dengan es batu 2biji kecil | 2 Didihkan air lalu matikan. Bentuk adonan lalu masukkan ke dalam air tadi biarkan sampai mengapung semuanya..nyalakan lagi kompornya dgn api kecil untuk mematangkan.. selesai angkat dan tiriskan | 3 Untuk cuko.. blender semua bahan kecuali jeruk kunci, gula aren | 4 Masukan gula aren ke dalam air lalu Didihkan, lalu masukkan bumbu yg tadi di blender | 5 Masukkan jeruk kunci..koreksi rasa asem, manis pedasnya | 6 Saring cuko agar nampak bersih saat di sajikan"
Sambel Terong (Eat Clean Version),https://img-global.cpcdn.com/recipes/3135f7872950fd1e/240x340cq50/sambel-terong-eat-clean-version-foto-resep-utama.webp,"2 buah terong ukuran sedang, potong-potong sesuai selera, rendam dalam air untuk mencegah browning; 2 sdm bumbu merah (bisa diganti 4 buah bawang merah, 2 buah bawang putih, dan 1 buah cabai keriting yang dihaluskan); 7 buah cabai rawit, iris-iris tipis; 1/2 sdt garam; 1 sdm gula; 3 sdm minyak sayur","1 Panaskan minyak di pan anti lengket. Tiriskan terong, lalu masukkan ke dalam pan. Masak hingga terong matang dan lembut. | 2 Sisihkan terong ke bagian tepi pan. Masukkan bumbu merah, tumis hingga harum. Lalu masukkan cabai, tumis hingga cabai layu. | 3 Tambahkan garam dan gula, aduk rata. Campur terong ke dalam sambal. | 4 Aduk rata, tes rasa. Sajikan dengan karbohidrat dan protein pilihan."
Abon Jamur,https://img-global.cpcdn.com/recipes/de3228fade93f9ad/240x340cq50/abon-jamur-foto-resep-utama.webp,"500 gr jamur tiram; 2 sdt maizena Rose Brand; 100 ml santan instan; 500 ml minyak untuk menggoreng abon; Bumbu Halus; 8 siung bawang merah; 5 siung bawang putih; 2 sdt ketumbar; 1 cm kunyit; 3-4 butir kemiri; Bumbu Pelengkap :; 1/4 sdt merica halus; 1,5 sdt garam / sesuai selera; 2 sdm kecap manis; 1 sdt gula pasir Rose Brand; 35 gr gula merah; Bumbu aromatik :; 1 batang sereh; 2 lembar daun salam; 3 cm lengkuas","1 Saya menggunakan gula dan tepung maizena produk dari Rose Brand yang sudah terpercaya kualitasnya. Dua produk ini wajib selalu ada di dapur saya. [Gambar: https://img-global.cpcdn.com/steps/17e1a13280d056ad/160x128cq70/abon-jamur-langkah-memasak-1-foto.jpg] | 2 Bersihkan jamur, kemudian rebus sebentar (5 menit) kemudian tiriskan, jika memungkinkan di peras. [Gambar: https://img-global.cpcdn.com/steps/2736bfda986d3be2/160x128cq70/abon-jamur-langkah-memasak-2-foto.jpg, https://img-global.cpcdn.com/steps/cdf9015d3896bd7b/160x128cq70/abon-jamur-langkah-memasak-2-foto.jpg] | 3 Tumbuk perlahan jamur sampai terlihat hancur berserat kemudian peras menggunakan kain muslin /kasa/ cheese cloth/ serbet bersih, sampai sebanyak mungkin cairan yang bisa di peras. [Gambar: https://img-global.cpcdn.com/steps/4afb7f1eb329e4fe/160x128cq70/abon-jamur-langkah-memasak-3-foto.jpg, https://img-global.cpcdn.com/steps/05c7743cd3b8acdc/160x128cq70/abon-jamur-langkah-memasak-3-foto.jpg, https://img-global.cpcdn.com/steps/bd4d7c126a6025d1/160x128cq70/abon-jamur-langkah-memasak-3-foto.jpg] | 4 Tumis bumbu halus dan bumbu aromatik sampai matang dan hilang bau langu nya, kemudian tambahkan santan, aduk rata lalu masukkan jamur dan bumbu pelengkap. Aduk rata sampai bumbu meresap. Bisa ditambah air sedikit jika saat mengaduk bumbu terasa terlalu kering. [Gambar: https://img-global.cpcdn.com/steps/35a322e6d6d6a729/160x128cq70/abon-jamur-langkah-memasak-4-foto.jpg, https://img-global.cpcdn.com/steps/1f13e5b1869a2b1b/160x128cq70/abon-jamur-langkah-memasak-4-foto.jpg] | 5 Setelah bumbu meresap, goreng jamur dalam minyak banyak sampai kering dan menjadi abon. Saat setengah kering, taburi dengan tepung maizena supaya cepat keringnya. (Saya menggoreng kurang lebih selama 40 menit). Setelah diangkat dari minyak keringkan lagi abon dari minyak. Biasanya menggunakan spinner untuk minyak. Bisa juga menggunakan tissue dapur kemudian diperas. [Gambar: https://img-global.cpcdn.com/steps/6900c08d418243de/160x128cq70/abon-jamur-langkah-memasak-5-foto.jpg, https://img-global.cpcdn.com/steps/b50656330124ddfe/160x128cq70/abon-jamur-langkah-memasak-5-foto.jpg, https://img-global.cpcdn.com/steps/b118bc7e71c5153c/160x128cq70/abon-jamur-langkah-memasak-5-foto.jpg]"
Tumis ayam buncis wortel (Eat Clean Series),https://img-global.cpcdn.com/recipes/10e801676c191b71/240x340cq50/tumis-ayam-buncis-wortel-eat-clean-series-foto-resep-utama.webp,"500 gr dada ayam tanpa tulang; 1 buah jeruk nipis; 2 buah wortel; 100 gr buncis; 1 bawang bombay uk. kecil; 2 siung bawang putih; 2 sdm Kecap manis; secukupnya kaldu jamur, garam, merica; bumbu marinade ''spicy big wing"" (no msg)","1 Lumuri ayam dengan air jeruk nipis. Diamkan 10 menit, lalu bilas dengan air bersih mengalir | 2 Potong dadu ayam, kemudian marinade dengan bumbu marinade, sejumput garam, merica secukupnya, diamkan sebentar [Gambar: https://img-global.cpcdn.com/steps/da7742fa8e476a6c/160x128cq70/tumis-ayam-buncis-wortel-eat-clean-series-langkah-memasak-2-foto.jpg] | 3 Potong wortel, buncis, dan bawang bombay, | 4 Tumis bawang putih sebentar, masukkan air, garam, merica, 1 sdm bumbu marinade, kecap, aduk rata, kemudian masukkan ayam, tunggu hingga matang dan air meresap sampai hampir surut | 5 Masukkan wortel, buncis, dan bawang bombay, aduk rata, tunggu sekitar 1 menit saja kemudian matikan api."
Clean Eating - Kembang Kol Ngohiang,https://img-global.cpcdn.com/recipes/d2dc5d95b4e3c620/240x340cq50/clean-eating-kembang-kol-ngohiang-foto-resep-utama.webp,"1 kembang kol besar, potong sesuai selera; 5 siung bawang putih, cacah; 1/2 sdt garam; sesuai selera Merica bubuk; 1/2 sdt gula pasir; 1/4 sdt bumbu ngohiang (chinese five-spices); 1/2 sdt kecap asin (optional); 1-2 tangkai daun bawang; 1 cabai merah besar, buang bijinya, potong- potong (bisa diskip); 3 sdm minyak kelapa","1 Cuci kembang kol yang telah dipotong - potong dengan air garam. Tiriskan hingga benar - benar kering. | 2 Panaskan oven pada suhu 230 derajat. Alasi loyang dengan aluminium foil / baking paper. | 3 Masukkan kembang kol ke dalam mangkok dan tambahkan 1 sdm minyak kelapa. Aduk rata. Kalau tidak ada minyak kelapa, bisa menggunakan minyak goreng apa saja. Tata kembang kol di atas loyang. Panggang selama sekitar 15 menit hingga kembang kol agak kecoklatan. [Gambar: https://img-global.cpcdn.com/steps/57a8ba074e7825bc/160x128cq70/clean-eating-kembang-kol-ngohiang-langkah-memasak-3-foto.jpg, https://img-global.cpcdn.com/steps/3b2e59e91114d922/160x128cq70/clean-eating-kembang-kol-ngohiang-langkah-memasak-3-foto.jpg] | 4 Di mangkok kecil : campur garam, merica, gula, dan bubuk ngohian hingga rata. Sisihkan. | 5 Cincang bawang putih dan goreng hingga kecoklatan dengam 2sdm minyak kelapa. Tiriskan bawang putih gorengnya. Dan sisakan hanya sedikit sekali minyak di wajan. | 6 Jika suka pedas, tumis potongan2 cabai merah tadi dengan menggunakan sedikit minyak yang tersisa di wajan hingga harum. Langkah ini bisa diskip jika tidak mau pedas. | 7 Masukkan kembang kol dan daun bawang. Aduk rata. Bisa ditambahkan kecap asin jika suka rasa yang lebih asin. Masukkan bawang putih goreng. Aduk rata. Sajikan. | 8 Bisa dimakan bersama nasi merah atau untuk cemilan."
Soto Ayam (Menu Eat Clean),https://img-global.cpcdn.com/recipes/13c343cf44e87df2/240x340cq50/soto-ayam-menu-eat-clean-foto-resep-utama.webp,"2 potong dada ayam; 1 bungkus soun jagung; Haluskan; 4 siung  bawang merah,; 2 siung  bawang putih; 1 buah  kemiri; 1 ruas jahe, kunyit, lengkuas pipihkan; 1 lembar daun salam,daun jeruk; secukupnya kol, touge, buncis (bisa gunakan sayur sesuai selera); Jeruk nipis; secukupnya Gula, ajinamoto, roiko","1 Panaskan air hingga mendidih. | 2 Kemudian masukkan ayam yg telah di lumuri garam terlebih dahulu. | 3 Masukkan bumbu halus, jahe, kunyit,lengkuas, daun jeruk, salam. Beri garam, dan penyedap rasa sesuai selera. | 4 Suir ayam yg telah matang. Hidangkan bersama soun yg telah di rendam air hangat,sayur, jeruk nipis, [Gambar: https://img-global.cpcdn.com/steps/89ab58e340ec4674/160x128cq70/soto-ayam-menu-eat-clean-langkah-memasak-4-foto.jpg]"
Bolu Pisang kukus tanpa terigu.. Clean eating,https://img-global.cpcdn.com/recipes/18bab255f3cade51/240x340cq50/bolu-pisang-kukus-tanpa-terigu-clean-eating-foto-resep-utama.webp,4 biji Pisang kepok; 2 telur ayam; 3 sdm vco; secukupnya Wijen sangrai; 3 buah kurma iris2,1 Blender jadi satu pisang telur vco sampe halus dan lembut lalu tuang ke dalam loyang atau wadah alfol | 2 Taburi topping kurma dan wijen lalu kukus 20 mnt
Clean Eating Aini'Cooking #2,https://img-global.cpcdn.com/recipes/3c08672feb624aca/240x340cq50/clean-eating-ainicooking-2-foto-resep-utama.webp,1 buah wortel kecil potong dadu; 1 buah jagung lalu serut; 1 buah tomat potong jadi 6 bagian; 1 buah timun kecil potong-potong; 3 lembar sawi putih potong-potong; 1 butir telor rebus setengah mateng; Secukupnya Kewpie wijen sangrai,"1 Siapkan semua siapkan semua bahan, cuci bersih lalu potong-potong seperti dalam keterangan diatas. | 2 Didihkan air lalu rebus wortel 3 menitan, lalu angkat dan tiriskan. | 3 Didihkan air lagi lalu rebus jagung 3 menitan, lalu angkay dan tiriskan. | 4 Rebus telur kurang lebih 7 menitan agar teksturnya nikmat, lalu rendam air dingin atau air es beberapa saat, kemudian kupas. | 5 Plating diatas piring semua bahan tadi, lalu tambahkan kewpie wijen sangrai. [Gambar: https://img-global.cpcdn.com/steps/2532d0d16e72c449/160x128cq70/clean-eating-ainicooking-2-langkah-memasak-5-foto.jpg, https://img-global.cpcdn.com/steps/6b764e5f831f6fd9/160x128cq70/clean-eating-ainicooking-2-langkah-memasak-5-foto.jpg]"
Clean Eating Aini'Cooking #18,https://img-global.cpcdn.com/recipes/e044b047ed420e0b/240x340cq50/clean-eating-ainicooking-18-foto-resep-utama.webp,1 Butir Telur; Secukupnya brokoli hijau; Secukupnya lada bubuk; Secukupnya kaldu jamur; Salad; secukupnya Jagung rebus; secukupnya Wortel rebus; secukupnya Timun; secukupnya Kewpie wijen shangrai,"1 Siapkan semua bahan lalu cuci bersih. | 2 Siapkan wadah kocok lepas telur lalu tambahkan kaldu jamur dan lada bubuk. | 3 Potong halus brokoli yang telah dicuci bersih, kemudian masukkan kedalam telur, aduk hingga rata. | 4 Panaskan wajan anti lengket lalu goreng hingga matang. | 5 Masukkan kepiring. Tambahkan salad yang telah dibuat juga lalu tambahkan kewpie wijen sangrai. | 6 Sajikan. [Gambar: https://img-global.cpcdn.com/steps/b1b689902a044761/160x128cq70/clean-eating-ainicooking-18-langkah-memasak-6-foto.jpg, https://img-global.cpcdn.com/steps/77ebfc1494ad4966/160x128cq70/clean-eating-ainicooking-18-langkah-memasak-6-foto.jpg]"
Diet/Clean food Soto daging lamongan FIBER CREME,https://img-global.cpcdn.com/recipes/06258cd826b5ec5e/240x340cq50/dietclean-food-soto-daging-lamongan-fiber-creme-foto-resep-utama.webp,1/4 lulur sapi; Bumbu utuh; 1 sereh geprek; 1 ruas jahe geprek; 1 ruas lengkuas geprek; 2 lembar daun jeruk; 2 lembar daun salam; Bumbu halus; 2 siung bawang putih; 4 siung bawang merah; 1 cabe besar; 10 ceb kecil (boleh skip); 1 ruas kunyit; Tambahan; 2 sdm fibercreme; Penyedap rasa sapi; Gula; Garam,"1 Potong kecil2 daging sapi cuci bersih | 2 Haluskan bumbu tumis sampai harum tanpa minyak, masukan bumbu utuh, tambahkan air dan masukan daging sapi.masak sampai daging empuk. | 3 Tambahkan bumbu pelengkap, 2 sdm fibercreme, penyedap, gula garam koreksi rasa, siap dihidangkan"
Bawal Bakar Teflon Bumbu Padang (Menu Eat Clean 🐟),https://img-global.cpcdn.com/recipes/3c60d2ef70286616/240x340cq50/bawal-bakar-teflon-bumbu-padang-menu-eat-clean-foto-resep-utama.webp,"1 kg ikan bawal (isi 6, yang ukuran sedang); 65 ml santan instan cair (sy skip, ganti dengan 100ml air 😊); 1 sdm gula merah sisir; 1 sdt garam; 1 sdt gula (sy skip, karena sudah pakai gula merah 😊); 1 sdt merica bubuk; 1 sdm minyak goreng utk menumis bumbu (sy pake corn oil); 1 sdm margarin (saya ganti dengan corn oil); Bumbu Halus; 15 siung bawang merah; 6 siung bawang putih; 4 buah cabe keriting; 5 butir kemiri (aslinya 3 bt, sy tambah krn gk pake santan); 1 sdt ketumbar bubuk; 3 cm kunyit (saya ganti 1 sdt kunyit bubuk); Bumbu Cemplung; 1 cm jahe, geprek; 1 cm lengkuas, geprek; 2 batang sereh, ambil putihnya, ikat, geprek; 4 lembar daun jeruk; 1 cm kayu manis; 2 butir kapulaga; 1 buah bunga lawang","1 Bersihkan ikan, cuci bersih, dikerat-kerat dagingnya supaya bumbu bisa masuk. Siapkan bumbu halus dan bumbu cemplung. [Gambar: https://img-global.cpcdn.com/steps/938403532e8b0c54/160x128cq70/bawal-bakar-teflon-bumbu-padang-menu-eat-clean-langkah-memasak-1-foto.jpg, https://img-global.cpcdn.com/steps/0a9e618c96a4076d/160x128cq70/bawal-bakar-teflon-bumbu-padang-menu-eat-clean-langkah-memasak-1-foto.jpg] | 2 Tumis bumbu halus dan bumbu cemplung hingga harum. Masukkan gula merah, biarkan mencair. Supaya tidak gosong, kecilkan apinya yaa. Tambahkan air dan biarkan mendidih. [Gambar: https://img-global.cpcdn.com/steps/056bd60fd0beebd5/160x128cq70/bawal-bakar-teflon-bumbu-padang-menu-eat-clean-langkah-memasak-2-foto.jpg, https://img-global.cpcdn.com/steps/eb3c16714b596fa6/160x128cq70/bawal-bakar-teflon-bumbu-padang-menu-eat-clean-langkah-memasak-2-foto.jpg, https://img-global.cpcdn.com/steps/90e098d908c983e1/160x128cq70/bawal-bakar-teflon-bumbu-padang-menu-eat-clean-langkah-memasak-2-foto.jpg] | 3 Setelah mendidih, masukkan ikan hingga terendam bumbu. Masak hingga ikan setengah matang atau air menyusut. Jangan sering dibolak balik ya supaya ikan tidak hancur. Angkat dan dinginkan ikan. [Gambar: https://img-global.cpcdn.com/steps/fbf9a0f2a22502d8/160x128cq70/bawal-bakar-teflon-bumbu-padang-menu-eat-clean-langkah-memasak-3-foto.jpg, https://img-global.cpcdn.com/steps/f9f4a98a654ac482/160x128cq70/bawal-bakar-teflon-bumbu-padang-menu-eat-clean-langkah-memasak-3-foto.jpg] | 4 Panggang ikan diatas teflon hingga ikan matang atau berwarna kecoklatan. Olesi ikan dengan bumbu sisa kuah. Angkat dan nikmati dengan nasi dan lalapan. [Gambar: https://img-global.cpcdn.com/steps/b48470db767f12be/160x128cq70/bawal-bakar-teflon-bumbu-padang-menu-eat-clean-langkah-memasak-4-foto.jpg, https://img-global.cpcdn.com/steps/5981dc244b96a73b/160x128cq70/bawal-bakar-teflon-bumbu-padang-menu-eat-clean-langkah-memasak-4-foto.jpg, https://img-global.cpcdn.com/steps/a7f1d82fd652a364/160x128cq70/bawal-bakar-teflon-bumbu-padang-menu-eat-clean-langkah-memasak-4-foto.jpg]"
Sup Sayur Kombinasi (Eat Clean),https://img-global.cpcdn.com/recipes/59bc3688e6c44b23/240x340cq50/sup-sayur-kombinasi-eat-clean-foto-resep-utama.webp,2 buah wortel potong bulan; 1 jagung manis pipil; 1 bungkul brokoli potong potong; 2 siung bawang putih geprek; 1 sdt garam; 1/2 sdt lada bubuk; 500 ml kaldu ayam; 1/2 sdt minyak sayur,1 Panaskan wajan masukkan minyak | 2 Tumis bawang putih hingga harum | 3 Masukkan air kaldu aduk merata | 4 Campurkan semua sayur ke dalam kuah kaldu | 5 Tunggu hingga sayur masak dan mendidih | 6 Sup sayur kombinasi siap dinikmati
Puding Nasi Cocopandan,https://img-global.cpcdn.com/recipes/8d347bee57131ed4/240x340cq50/puding-nasi-cocopandan-foto-resep-utama.webp,"150 gr nasi sisa semalam; 300 ml susu cair (3 sdm susu bubuk fullcream + air = 300 ml); 80 gr gula pasir (menurut saya ini masih agak kemanisan); Sejimpit garam; 50 gr kismis (skip, lagi kosong); 1/8 sdt vanili bubuk; 3 tetes pasta cocopandan; Secukupnya bubuk kayu manis (skip); Secukupnya keju cheddar parut","1 Siapkan panci, masukkan nasi dan tuang susu cair. Aduk dulu hingga tercampur rata. [Gambar: https://img-global.cpcdn.com/steps/5e9baf66350e013a/160x128cq70/puding-nasi-cocopandan-langkah-memasak-1-foto.jpg, https://img-global.cpcdn.com/steps/3a47eaecc7c2330f/160x128cq70/puding-nasi-cocopandan-langkah-memasak-1-foto.jpg] | 2 Rebus hingga nasi empuk, lalu masukkan gula pasir, kismis, vanili bubuk, dan garam. Aduk-aduk dan masak hingga susu menyusut/mengental. Angkat. [Gambar: https://img-global.cpcdn.com/steps/0f32114b278f930b/160x128cq70/puding-nasi-cocopandan-langkah-memasak-2-foto.jpg, https://img-global.cpcdn.com/steps/c67887c677a22c0c/160x128cq70/puding-nasi-cocopandan-langkah-memasak-2-foto.jpg] | 3 Tuang ke dalam jar/gelas/wadah, dan dinginkan. Lalu taburi bubuk kayu manis dengan cara diayak. Jika hendak diberi warna seperti saya, setelah diangkat lalu beri secukupnya pasta makanan. Perasa/pastanya sesuaikan dengan selera saja. Aduk rata lalu tuang ke dalam wadah. Biarkan dingin lalu beri topping keju cheddar parut. Sajikan dingin lebih nikmat. Enjoyy..😘😘 [Gambar: https://img-global.cpcdn.com/steps/7b19adfd142bbe65/160x128cq70/puding-nasi-cocopandan-langkah-memasak-3-foto.jpg, https://img-global.cpcdn.com/steps/bb2d3ca67bd50b69/160x128cq70/puding-nasi-cocopandan-langkah-memasak-3-foto.jpg, https://img-global.cpcdn.com/steps/cba4afe54e4f8008/160x128cq70/puding-nasi-cocopandan-langkah-memasak-3-foto.jpg]"
Soto Kentang Wortel (clean eating),https://img-global.cpcdn.com/recipes/0cacaca6a24b8a04/240x340cq50/soto-kentang-wortel-clean-eating-foto-resep-utama.webp,Bahan geprek:; 2 cm jahe; 3 cm lengkuas; 2 cm kunyi; 1 cm kunci; 1 cm kencur; 1 buah serai; Bumbu halus:; 3 buah bawang merah; 2 buah bawang putih; Secukupnya ketumbar; Bahan lainnya:; 1 buah kentang; 1 buah wortel; 1 batang daun bawang; 1 lembar daun jeruk; 1 lembar daun salam; 1/2 sdm gula; Secukupnya garam; Secukupnya merica bubuk; Secukupnya kaldu jamur (totole),"1 Kupas dan potong kentang beserta wortel. Sisihkan | 2 Siapkan bahan geprekan dan bumbu halus | 3 Panaskan teflon, beri sedikit margarin. Masukan bumbu geprek, bumbu halus, daun jeruk dan daun salam. Tumis hingga harum, lalu tambahkan air. | 4 Masukan potongan kentang dan wortel. Tunggu hingga mendidih, lalu tambahkan daun bawang yg sudah dipotongi. Tambahkan garam, gula, kaldu jamur sesuai selera. | 5 Masak hingga kentang dan wortel empuk. Setelah itu koreksi rasa dan voilaaa sudah bisa dinikmati."
Bakso Ayam Kukus (Menu Eat Clean),https://img-global.cpcdn.com/recipes/259bd6361104e61c/240x340cq50/bakso-ayam-kukus-menu-eat-clean-foto-resep-utama.webp,"200 gr dada ayam fillet; 1 bt kuning telur; 1 siung bawang putih; 1 sdm minyak wijen (opsional, bisa di skip, bisa juga diganti dengan corn oil/minyak zaitun); 1 sdt merica (opsional, bisa menggunakan merica bubuk); 1/2 sdt garam","1 Cuci bersih dada ayam fillet dan di giling (bisa juga dicincang kasar sesuai selera, kalau saya suka di cincang kasar supaya masih terasa teksturnya). Haluskan bawang putih dan merica. [Gambar: https://img-global.cpcdn.com/steps/3f0996365fdce3f1/160x128cq70/bakso-ayam-kukus-menu-eat-clean-langkah-memasak-1-foto.jpg, https://img-global.cpcdn.com/steps/99cd1777a35eb5a7/160x128cq70/bakso-ayam-kukus-menu-eat-clean-langkah-memasak-1-foto.jpg, https://img-global.cpcdn.com/steps/f69f4fec0c0d1edf/160x128cq70/bakso-ayam-kukus-menu-eat-clean-langkah-memasak-1-foto.jpg] | 2 Campur fillet ayam yang sudah dicincang dengan kuning telur, minyak wijen, garam dan bumbu halus (bawang putih dan merica). Adonan diaduk-aduk hingga tercampur rata dan bisa dibentuk bulat atau sesuai selera. [Gambar: https://img-global.cpcdn.com/steps/5923816a82d8239e/160x128cq70/bakso-ayam-kukus-menu-eat-clean-langkah-memasak-2-foto.jpg, https://img-global.cpcdn.com/steps/dc18c643912310ef/160x128cq70/bakso-ayam-kukus-menu-eat-clean-langkah-memasak-2-foto.jpg, https://img-global.cpcdn.com/steps/802ca81b09615daa/160x128cq70/bakso-ayam-kukus-menu-eat-clean-langkah-memasak-2-foto.jpg] | 3 Sambil menunggu adonan dibentuk, panaskan panci kukusan, lapisi daun pisang atau alumunium foil supaya bakso tidak lengket di panci kukusan. Setelah air mulai mendidih, bakso bisa di kukus selama 10 - 15 menit atau hingga matang. [Gambar: https://img-global.cpcdn.com/steps/c660ae4b469e1397/160x128cq70/bakso-ayam-kukus-menu-eat-clean-langkah-memasak-3-foto.jpg, https://img-global.cpcdn.com/steps/d8122bdce18d3267/160x128cq70/bakso-ayam-kukus-menu-eat-clean-langkah-memasak-3-foto.jpg] | 4 Bakso bisa langsung diolah sebagai menu utama atau bahan campuran masakan seperti bakso kuah, steamboat sayuran, sop, capcay, dll. Menu berbahan bakso kukus ayam bisa dicek di resep menu eat clean mama akmal yaaa 😍😘"
"Perkedel clean eater (eggless, no salt)",https://img-global.cpcdn.com/recipes/58497e1480584ed4/240x340cq50/perkedel-clean-eater-eggless-no-salt-foto-resep-utama.webp,5 bh kentang; 2 siung bawang putih; 4 siung bawang merah; secukupnya Merica; secukupnya Penyedap jamur; 1 sachet kornet; Minyak canola,"1 Cuci kentang, kupas, siapkan air untuk merendam kentang setelah dikupas agar tidak menghitam, potong dadu kentang [Gambar: https://img-global.cpcdn.com/steps/943d755ebddc0c13/160x128cq70/perkedel-clean-eater-eggless-no-salt-langkah-memasak-1-foto.jpg] | 2 Goreng kentang dengan minyak canola (api kecil-sedang saja), agak lama supaya kentang matang merata dan tidak pecah saat nanti digoreng setelah jadi, karena ga akan paki telur [Gambar: https://img-global.cpcdn.com/steps/4ff38d0f0fcc0020/160x128cq70/perkedel-clean-eater-eggless-no-salt-langkah-memasak-2-foto.jpg] | 3 Setelah kuning kecoklatan angkat dan tiriskan sampai kering dan dingin [Gambar: https://img-global.cpcdn.com/steps/e50aecbe5e8124b9/160x128cq70/perkedel-clean-eater-eggless-no-salt-langkah-memasak-3-foto.jpg] | 4 Tumbuk kentang hingga halus [Gambar: https://img-global.cpcdn.com/steps/c95425070a6726ad/160x128cq70/perkedel-clean-eater-eggless-no-salt-langkah-memasak-4-foto.jpg] | 5 Uleg bawang putih, bawang merah, merica, dan penyedap jamur | 6 Campurkan bumbu halus dan kornet dengan kentang tumbuk, aduk rata [Gambar: https://img-global.cpcdn.com/steps/f94e3eea495830e1/160x128cq70/perkedel-clean-eater-eggless-no-salt-langkah-memasak-6-foto.jpg] | 7 Uleni sampai kalis [Gambar: https://img-global.cpcdn.com/steps/c2417f6fa0b1c9ef/160x128cq70/perkedel-clean-eater-eggless-no-salt-langkah-memasak-7-foto.jpg] | 8 Bentuk sesuai keinginan, lalu goreng tanpa telur [Gambar: https://img-global.cpcdn.com/steps/4a7a78c02f3351eb/160x128cq70/perkedel-clean-eater-eggless-no-salt-langkah-memasak-8-foto.jpg]"
Clean Eating Aini'Cooking #34,https://img-global.cpcdn.com/recipes/e7473d2e4048069d/240x340cq50/clean-eating-ainicooking-34-foto-resep-utama.webp,2 buah tahu potong dadu; 1 dada ayam potong dadu; 1 bonggol pakcoy; 1 bawang putih; 1 bawang merah; 3 cabe rawit; Secukupnya saus tiram; Secukupnya kecap manis; Secukupnya garam; Secukupnya lada bubuk,"1 Siapkan semua bahan. | 2 Tumis tanpa minyak bawang merah bawang putih dan cabai, lalu masukkan ayam, aduk aduk hingga setengah matang dan berubah warna. | 3 Masukkan tahu, aduk rata. | 4 Tambahkan secukupnya air. | 5 Tambahkan saus tiram kecap garam dan lada bubuk. | 6 Masak beberapa saat hingga mendidih. Lalu masukkan pakcoy yang sudah dipotong sesuai selera. | 7 Masak hingga matang. | 8 Koreksi rasa. | 9 Sajikan. [Gambar: https://img-global.cpcdn.com/steps/a729505566b796da/160x128cq70/clean-eating-ainicooking-34-langkah-memasak-9-foto.jpg, https://img-global.cpcdn.com/steps/57d7be6f4c734f42/160x128cq70/clean-eating-ainicooking-34-langkah-memasak-9-foto.jpg, https://img-global.cpcdn.com/steps/91de28f08bfd4ff9/160x128cq70/clean-eating-ainicooking-34-langkah-memasak-9-foto.jpg]"
"Healthy Simple Breakfast (Eat clean series) ""Spanish Frittata""",https://img-global.cpcdn.com/recipes/69fecaf89e785d90/240x340cq50/healthy-simple-breakfast-eat-clean-series-spanish-frittata-foto-resep-utama.webp,"3 butir kentang ukuran sedang; 3 butir telur; 1 buah bawang bombay ukuran kecil; 1 buah tomat; 2 sdm minyak zaitun; secukupnya daun kemangi  (optional); secukupnya garam, lada, kaldu jamur, daun oregano","1 Potong dadu kentang yang sudah di cuci bersih (tips : masak kentang dengan kulitnya agar nutrisi kentang tetap terjaga) [Gambar: https://img-global.cpcdn.com/steps/d9bea37853d857bb/160x128cq70/healthy-simple-breakfast-eat-clean-series-spanish-frittata-langkah-memasak-1-foto.jpg] | 2 Rebus kentang hingga matang, kurang lebih 15 menit, tusuk dengan garpu untuk mengetahui kematangan kentang [Gambar: https://img-global.cpcdn.com/steps/5d8e74a98c7b6e3b/160x128cq70/healthy-simple-breakfast-eat-clean-series-spanish-frittata-langkah-memasak-2-foto.jpg] | 3 Sembari menunggu kentang matang, potong potong bawang bombay sesuai selera [Gambar: https://img-global.cpcdn.com/steps/d4f09320f64b8439/160x128cq70/healthy-simple-breakfast-eat-clean-series-spanish-frittata-langkah-memasak-3-foto.jpg] | 4 Setelah kentang matang, tiriskan. Kocok lepas telur pada mangkuk, masukkan bahan bahan lain nya (daun kemangi, daun oregano, bawang bombay, garam, lada kaldu jamur dan juga kentang rebus) campur hingga merata [Gambar: https://img-global.cpcdn.com/steps/ba4923dcbe15b23f/160x128cq70/healthy-simple-breakfast-eat-clean-series-spanish-frittata-langkah-memasak-4-foto.jpg] | 5 Masukan minyak zaitun pada wajan, (tips : tidak perlu menunggu hingga panas agar tidak merusak kandungan minyak zaitun), masukkan telur yang telah tercampur dengan bahan-bahan lainnya dengan api sedang [Gambar: https://img-global.cpcdn.com/steps/d93d70ef2125e140/160x128cq70/healthy-simple-breakfast-eat-clean-series-spanish-frittata-langkah-memasak-5-foto.jpg] | 6 Masak hingga matang, untuk mengetahui kematangan telur bisa ditusuk dengan garpu [Gambar: https://img-global.cpcdn.com/steps/1b94f7b3bf80b1db/160x128cq70/healthy-simple-breakfast-eat-clean-series-spanish-frittata-langkah-memasak-6-foto.jpg] | 7 Hidangkan dengan tomat segar yg telah dipotong potong [Gambar: https://img-global.cpcdn.com/steps/a758ee1e272bdaa8/160x128cq70/healthy-simple-breakfast-eat-clean-series-spanish-frittata-langkah-memasak-7-foto.jpg]"
